Company Name,Address,Phone,Website
IMS Wealth Ltd,undefined11 Whinfield Martlesham Heath   Ipswich Suffolk IP5 3TR UNITED KINGDOM , 44 1473636100 ,
Oyster Wealth Management Limited,undefined21-24 Bradfield Road Finedon Road Industrial Estate   Wellingborough Northamptonshire NN8 4HB UNITED KINGDOM , 0845 2575365 ,www.oysterwealth.co.uk
Tarvos Wealth Limited,undefinedWatling Chambers 18-19 Watling Street   Canterbury Kent CT1 2UA UNITED KINGDOM , 44 1227761177 ,www.tarvoswealth.co.uk
Lamont Pridmore Asset and Wealth Management Limited,undefinedMilburn House 3 Oxford Street   Workington Cumbria CA14 2AL UNITED KINGDOM , 44 0190065955 ,www.lamontpridmore.co.uk
Academy Associates Wealth Management Ltd,undefined1 Eastfield Road Westbury-on-Trym   Bristol Somerset BS9 4AD UNITED KINGDOM , 44 01174400128 ,
Fortuna Wealth Management Limited,undefined24 Cannon Road Wombourne   Wolverhampton Staffordshire WV5 9HR UNITED KINGDOM , 44 7946380443 ,
Scotia Wealth Management Ltd,undefined36-38 Salamander Street    Edinburgh Midlothian EH6 7HZ UNITED KINGDOM , 44 1315554920 ,
Optimas Wealth Planners Limited,undefinedThe Old Forge Moseley Hall Farm Chelford  Knutsford Cheshire WA16 8RB UNITED KINGDOM , 44 001565621211 ,www.optimas-wp.co.uk
Wealth Wizards Benefits Limited,undefinedWizards House 8 Athena Court Tachbrook Park  Leamington Spa Warwickshire CV34 6RT UNITED KINGDOM , 44 1926671469 ,
Condies Wealth Strategies Limited,undefined10 Abbey Park Place    Dunfermline Fife KY12 7NZ UNITED KINGDOM , 44 1383721421 ,
Wealth Management Experts Ltd,undefined46 Bramble Gardens    Burgess Hill West Sussex RH15 8UQ UNITED KINGDOM , 44 03333445546 ,www.wealthmanagementexperts.net
Enhanced Wealth Limited,undefined140 Long Lane    Bexleyheath Kent DA7 5AH UNITED KINGDOM , 44 02083017930 ,www.enhancedwealth.co.uk
Evolve Wealth Limited,undefinedWellowgate House 13 Wellowgate   Grimsby N E Lincs DN32 0RA UNITED KINGDOM , 44 01472362899 ,www.evolvewealth.co.uk
Charterhouse Wealth Managers LLP,undefinedTemple Chambers 3-7 Temple Avenue   London  EC4Y 0HP UNITED KINGDOM , 44 08453190009 ,charterhousewm.com
Thomson Wealth Management Ltd,undefinedFirst Floor 34 West George Street   Glasgow Lanarkshire G2 1DA UNITED KINGDOM , 44 7734431456 ,www.thomsonwealth.co.uk
Fraser Wealth Management Ltd,undefinedExchange Station Tithebarn Street   Liverpool Merseyside L2 2QP UNITED KINGDOM , +44 1512582520 ,www.fraserwm.co.uk
Sweeny Wealth Management Ltd,undefined3 Fortress Fields Great Waldingfield   Sudbury Suffolk CO10 0FF UNITED KINGDOM , 44 1787370460 ,www.sweenywealth.co.uk
Oaklands Wealth Management Ltd,undefined12a Duke St    Sutton Coldfield West Midlands B72 1RJ UNITED KINGDOM , 44 01213554455 ,www.oaklandswealth.com
Templetonburn Wealth Management Ltd,undefinedMeadow Cottage Templetonburn   Kilmarnock Ayrshire KA3 6HP UNITED KINGDOM , 44 1563521799 ,
Castlefield Fund Partners Limited,undefinedRodwell Tower 111 Piccadilly   Manchester Greater Manchester M1 2HY UNITED KINGDOM , 44 01612334550 ,www.castlefield.com
Moneyology Limited,undefined16 Burghley Rise Burwell   Cambridge Cambridgeshire CB25 0RS UNITED KINGDOM , +44 01638743857 ,
Utopia Wealth Planning Ltd,undefined128 Dargate Road Yorkletts   Whitstable Kent CT5 3AG UNITED KINGDOM , 44 1227262624 ,
Phillip Copp Financial Planning Ltd,undefined71 Mansel Street    Swansea Abertawe SA1 5TN UNITED KINGDOM , +44 01792641455 ,
Kent Carlyle Wealth Management Ltd,undefined2-4 Lion & Castle Yard Timberhill   Norwich Norfolk NR1 3JT UNITED KINGDOM , 44 01603567197 ,www.kentcarlyle.co.uk
Planet 3 Wealth Limited,undefined112a St Teilo Street Pontarddulais   Swansea  SA4 8SR UNITED KINGDOM , 44 01792885330 ,www.planet3wealth.co.uk
Whiting & Partners Wealth Management Limited,undefined12/13 The Crescent    Wisbech Cambs PE13 1EH UNITED KINGDOM , 44 01945581937 ,www.whitingandpartnerswm.co.uk
Wealth Club Limited,undefined4 Broad Plain    Bristol Avon BS2 0JP UNITED KINGDOM , 44 1179290511 ,
Provisio Limited,undefinedThe Nexus Building Broadway   Letchworth Garden City Hertfordshire SG6 9BN UNITED KINGDOM , +44 01462687337 ,www.provisio.co.uk
Frensham Wealth Limited,undefined27 Hillrise    Walton-on-Thames Surrey KT12 2PE UNITED KINGDOM , 44 1932422985 ,www.frenshamwealth.co.uk/
LCM Wealth Management Ltd,undefinedRutherford House Warrington Road Birchwood  Warrington Cheshire WA3 6ZH UNITED KINGDOM , 44 01925843950 ,www.lcmwealth.co.uk
LFP Financial Planning & Wealth Management Limited,undefined21 Spark Lane Mapplewell   Barnsley South Yorkshire S75 6AA UNITED KINGDOM , 44 01226390010 ,
KMD Private Wealth Management Limited,undefinedWestern House 2 Cambridge Road   Stansted Essex CM24 8BZ UNITED KINGDOM , 44 1279647663 ,
BKD Wealth Management Limited,undefined44 Mountfield Road    London  W5 2NQ UNITED KINGDOM , 44 2085665550 ,www.bkdfinancial.net
The Wealth Management Group LLP,undefinedSuite 702 VM-2 Victoria Mills Salts Mill Road  Shipley West Yorkshire BD17 7DF UNITED KINGDOM , 44 03332400396 ,www.wealthmanagementllp.co.uk
Lexington Wealth Management Ltd,undefinedOrchard House Bagbury Lane   Lydiard Millicent Wiltshire SN5 4LX UNITED KINGDOM , 44 01793771093 ,www.LexingtonWealth.co.uk
Above Wealth Management  LLP,undefined12 Hay Hill    London  W1J 8NR UNITED KINGDOM , 44 2037252740 ,http://www.abovewealth.com
Panoramic Wealth Management Ltd,undefined2nd Floor Richmond Terrace 49 London Road   Tunbridge Wells Kent TN1 1DT UNITED KINGDOM , 44 1892559555 ,www.panoramicwealth.co.uk
Crown Wealth Management Limited,undefinedColumn House 7 London Road   Shrewsbury Shropshire SY2 6NN UNITED KINGDOM , 44 01743276797 ,www.crownwealthmanagement.co.uk
KW Trading Services Limited,undefined10-11 Austin Friars    London  EC2N 2HG UNITED KINGDOM , 44 2072930730 ,www.europeanwealth.com
Bluestone Wealth Management Ltd,undefined193 Caerleon Road    Newport Gwent NP19 7HA UNITED KINGDOM , +44 01633841805 ,-
Lee Wealth Management Ltd,undefined174 Eastham Rake    Wirral Merseyside CH62 9AJ UNITED KINGDOM , +44 01513273323 ,-
Thomson Gray Wealth Management Limited,undefined4 Duncan Close Moulton Park   Northampton Northamptonshire NN3 6WL UNITED KINGDOM , 44 01604499134 ,www.thomsongray.co.uk
Phoenix Wealth Management Ltd.,"undefinedDunraven House 41 Meadow Court, High Street   Witney Oxfordshire OX28 6ER UNITED KINGDOM ", 44 1993229904 ,
Sama Wealth Limited,undefined50 Jermyn Street    London  SW1Y 6LX UNITED KINGDOM , +44 02031953025 ,www.samaweathl.com
Pure Wealth Limited,"undefinedBeech House, 3 Beechwood Close    Hertford Hertfordshire SG13 7HW UNITED KINGDOM ", 44 1992554806 ,www.purewealthltd.com
AGL Wealth Management Ltd,undefined241 St Vincent Street    Glasgow Lanarkshire G2 5QY UNITED KINGDOM , +44 01413487710 ,www.aglwealth.com
Professional Wealth Management Ltd,undefined1 Lambton Road Jesmond   Newcastle upon Tyne Tyne and Wear NE2 4RX UNITED KINGDOM , 44 01912614804 ,www.professionalwealthmanagement.co.uk
Plan For Life Wealth Management Limited,undefined15 Hills Lane    Shrewsbury Shropshire SY1 1QU UNITED KINGDOM , 44 1743818626 ,
Cedar Wealth Limited,undefined4th Floor Victoria House Victoria Road  Chelmsford Essex CM1 1JR UNITED KINGDOM , +44 02034781505 ,www.cedarwealth.co.uk
Phoenix Wealth Solutions Limited,undefined22 Church Street    Johnstone Renfrewshire PA5 8DU UNITED KINGDOM , 44 1505325900 ,www.phoenixwealthsolutions.com
Alpha Wealth Management Limited,undefined52 Finchley Lane    London  NW4 1DJ UNITED KINGDOM , 44 2082036920 ,
Aspire Wealth Limited,undefinedPlum Cottage Newlands Grange   Shotley Bridge County Durham DH8 9LH UNITED KINGDOM , 44 01207588999 ,aspirewealthlimited.co.uk
Kingswood Wealth Management Ltd,undefinedManor House Long Lane Limefield  Bury Lancashire BL9 5QT UNITED KINGDOM , 44 01617620108 ,www.kingswoodwealth.trustedadviser.info
Iron Wealth Management Limited,undefined65 Holst Crescent Old Farm Park   Milton Keynes Buckinghamshire MK7 8QN UNITED KINGDOM , 44 1908382168 ,www.ironwealth.co.uk
CST Wealth Management Limited,undefined2 Oldfield Road Bocam Park Bridgend    CF35 5LJ UNITED KINGDOM , 44 01656867167 ,
Burnett & Reid Wealth Management Limited,undefined15 Golden Square    Aberdeen Aberdeenshire AB10 1WF UNITED KINGDOM , 44 1224644333 ,
Aqua Wealth Management Limited,undefinedHeath House 156a Sandridge Road St Albans  Herts  AL1 4AP UNITED KINGDOM , 44 01727899244 ,
Affinity Wealth Management (NW) Ltd,undefined24 Wynnstay Road    Colwyn Bay Conwy LL29 8NB UNITED KINGDOM , +44 01492531578 ,
Thomas Anthony Wealth Management Limited,undefinedLonbury House 495 Green Lanes   London  N13 4BS UNITED KINGDOM , +44 02088865500 ,www.thomasanthony.com
Glasgow Wealth Limited,undefinedFifth Floor Merchants House 30 George Square   Glasgow  G2 1EG UNITED KINGDOM , 44 01413283916 ,http://www.glasgowwealth.co.uk
Citrus Wealth Management Limited,undefinedThe Strand Wherstead   Ipswich Suffolk IP2 8NJ UNITED KINGDOM , 44 2070592150 ,www.citrusgroup.co.uk
Wealth UK (Financial) Ltd,undefined39 Merlewood Avenue    Southport Merseyside pr9 7ns UNITED KINGDOM , 44 01704513262 ,www.wealthukfinancial.com
Mark Raymond Green,undefined1 Helgiford Gardens    Sunbury-on-Thames Surrey TW16 7NB UNITED KINGDOM , +44 01932784564 ,www.mark-green.net
COMMONWEALTH DENTAL PRACTICE LTD,undefined362 Duke Street    Glasgow Lanarkshire G31 1RE SCOTLAND , +44 01415542460 ,
Bright Square Pensions Limited,undefinedSussex House North Street   Horsham West Sussex RH12 1RQ UNITED KINGDOM , 44 8081698039 ,www.benchmarkcapital.co.uk
Barclays Asset Management Limited,undefined1 Churchill Place    London  E14 5HP UNITED KINGDOM , +44 02035551077 ,
Laurent Wealth Management Limited,undefined134 Appletree Lane    Redditch Worcestershire B97 6TS UNITED KINGDOM , 44 152766554 ,lwmifa.co.uk
Buckingham Bridge Finance Corp Ltd,undefined7 Brockwell Avenue    Beckenham Kent BR3 3GE UNITED KINGDOM ,  02089355867 ,
Richmonde Laine Wealth Management Ltd,undefined18 Station Approach    Bradford-on-Avon Wiltshire BA15 1FQ UNITED KINGDOM , 44 1225869090 ,
Custodian Wealth Management Limited,undefinedSuite 35 The Sands Business Centre Sands Road The Sands Farnham Surrey GU10 1PX UNITED KINGDOM , 44 01252782731 ,www.custodianifa.co.uk
Priscum Limited,undefinedMarston Hall Industrial Park Marston Lane Marston Jabbett  Bedworth Warwickshire CV12 9SD UNITED KINGDOM , 44 01600483600 ,www.priscum.com
Wealth Aspirations LLP,undefinedCoal Road    Leeds West Yorkshire LS14 2AL UNITED KINGDOM , 44 01132659228 ,-
Logic Wealth Planning Limited,undefinedSigma House 9 Southgate Cross Street off Green Lane  Heywood Greater Manchester OL10 1ND UNITED KINGDOM , 44 08081234321 ,www.logic-wp.com
Asquire Wealth Management Ltd,undefinedParkshot House 5 Kew Rd   Richmond London TW9 2PR ENGLAND , 44 08000129016 ,www.asquirewealth.com
Dartington Wealth Management Limited,undefined5b Clifton Court    Cambridge  CB1 7BN UNITED KINGDOM , 44 1223211122 ,www.dartingtonwealth.com
Wildwood Wealth Management Limited,undefined4 Wildgoose Drive    Horsham West Sussex RH12 1TU UNITED KINGDOM , 44 1403221884 ,
Metis Wealth Ltd,undefinedBrooklands Barn Rocky Lane   Haywards Heath West Sussex RH16 4RR UNITED KINGDOM , 44 3454505670 ,www.metiswealth.co.uk
Timeline Wealth Management Ltd,undefined3 Hill Farm View Dullingham   Cambridge Cambridgeshire CB8 9FF UNITED KINGDOM , 44 01733372686 ,www.timelinewealth.com
Edinburgh Wealth Management Limited,undefined27a Alva St    Edinburgh Midlothian EH2 4PS UNITED KINGDOM , 44 01312258670 ,www.edinburghwealthmanagement.co.uk
Benchmark Wealth Management Limited,undefined12 Princess Street    Knutsford Cheshire WA16 6DD UNITED KINGDOM , 44 1565658807 ,
Moss And Roberts (Wealth Management) Ltd,undefinedOffice Suite 3 Victory House Chequers Road Tharston Norwich Norfolk NR15 2YA UNITED KINGDOM , 44 01508530567 ,
Bamford Wealth Management Ltd,undefinedBarnaby Bamford Troyte House Sandys Road  Malvern Worcestershire WR14 1JJ UNITED KINGDOM , 44 01684562842 ,
Solutions Wealth Management Limited,undefinedWellington House Falcon Court   Stockton-on-Tees Durham TS18 3TS UNITED KINGDOM , 44 1642927685 ,www.swmltd.co.uk
JG Wealth Management Limited,undefined10 Lower Thames Street    London  EC3R 6AF UNITED KINGDOM , 44 0203972622 ,www.jgwealth.co.uk
First Wealth Management Limited,undefined2a Portman Mansions Chiltern St   London  W1U 6NR UNITED KINGDOM , 44 02032195995 ,-
ARDEN WEALTH MANAGEMENT LIMITED,undefined125 Old Broad Street    London  EC2N 1AR UNITED KINGDOM , 44 1214238900 ,
Ellacotts Wealth Planning Ltd,undefinedCountrywide House 23 West Bar   Banbury Oxfordshire OX16 9SA UNITED KINGDOM , 44 01295250401 ,www.ellacottswealth.co.uk
PWH Financial Planning Ltd,undefinedVictoria House 14a Bradford Road Guiseley  Leeds West Yorkshire LS20 8NH UNITED KINGDOM , +44 01943871638 ,
Investa Wealth Management Limited,undefined143 Commercial Street    Maesteg Mid Glamorgan CF34 9DW UNITED KINGDOM , +44 1656739135 ,
Nean Wealth Advisors (UK) Limited,undefinedNo 22 Upper Brook Street London    W1K 7PZ ENGLAND , +44 02037282780 ,www.neanwealthadvisors.com
Selfie Wealth Limited,undefined17 Carlisle Street    London  W1D 3BU UNITED KINGDOM , 44 7944769582 ,www.selfiewealth.com
Stargate Capital Management Limited,undefined19 Hillersdon Avenue    Edgware  HA8 7SG UNITED KINGDOM , 44 07970081220 ,-
Heartwood Wealth Management Limited,undefinedNo.1 Kingsway    London  WC2B 6AN UNITED KINGDOM , 44 02070451320 ,www.heartwoodgroup.co.uk
Ashburn Wealth Management Limited,undefined84 Grange Road    Darlington County Durham DL1 5NP UNITED KINGDOM , 44 01325385210 ,www.ashburnwealth.com
Prime Wealth Solutions Ltd,undefinedSterling House 49 Main Road Leabrooks  Alfreton Derbyshire DE55 1LA UNITED KINGDOM , 44 1773607100 ,
Laver Wealth Management Limited,undefined9 Beaconsfield Road    Weston-super-Mare Somerset BS23 1YE UNITED KINGDOM , 44 01934645511 ,www.laverwealth.co.uk
Hartey Wealth Management Ltd,undefined9-11 Salop Road    Oswestry Shropshire SY11 2NR UNITED KINGDOM , 44 01691654613 ,-
Abacus Wealth Planning Ltd,undefinedAdelaide House 12 King Edward Road   Brentwood Essex CM14 4HL UNITED KINGDOM , 44 01708229999 ,-
Altor Wealth Management LLP,undefinedCable House Hunts Common Hartley Wintney  Hook Hampshire RG27 8AB UNITED KINGDOM , 44 08003688900 ,www.altorwealth.com
Brooks Wealth Management LLP,undefined10 Radnor Road Henleaze   Bristol Avon BS9 4DX UNITED KINGDOM , 44 01179622962 ,www.brookswm.co.uk
Sigma Wealth Limited,undefinedHouse by The Square 10-12 Wood Road Codsall  Wolverhampton West Midlands WV8 1DE UNITED KINGDOM , 44 1902843456 ,
BEST Wealth Management Ltd,undefined6 Butlers Field Langar   Nottingham Nottinghamshire NG13 9HS UNITED KINGDOM , 44 01949861477 ,
Kilgour Wealth Management Limited,undefinedSuite 4 First Floor Stuart House Eskmills Business Centre Musselburgh East Lothian EH21 7PB UNITED KINGDOM , +44 01312735244 ,www.kilgourwealth.co.uk
ISM Wealth Planning LLP,undefinedDerwent Barn 3 School Close Palterton  Chesterfield Derbyshire S44 6RN UNITED KINGDOM , 44 1246241234 ,
Wealth Protect Ltd,undefinedWealth Protect Ltd 14 Peckingham Street   Halesowen West Midlands B63 3AN UNITED KINGDOM , 44 1215858885 ,
Clearwater Wealth Management LLP,undefined42 Wycombe Road Holmer Green   High Wycombe Buckinghamshire HP15 6RY UNITED KINGDOM , 44 01494717000 ,www.clearwaterwealth.co.uk
Paton Wealth Management Limited,undefined5 Princes Terrace    Glasgow Lanarkshire G12 9JW UNITED KINGDOM , +44 01413535048 ,www.patonwealthmanagement.co.uk
Warwick Wealth Management Ltd,undefinedRyknild House Burnett Road   Sutton Coldfield West Midlands B74 3EL UNITED KINGDOM , 44 01215130810 ,www.warwickwm.co.uk
Norman Watts Wealth Management Limited,undefined4 Spalding Way    Chelmsford Essex CM2 7NZ UNITED KINGDOM , 44 7973363407 ,
Appleton Fox Wealth Management Ltd,undefinedSouthfield House 2 Southfield Road Westbury On Trym  Bristol  BS9 3BH UNITED KINGDOM , 44 01172140017 ,www.appletonfox.co.uk
Felton Wealth Management Ltd,undefined6 Endor Crescent Burley in Wharfedale   Ilkley West Yorkshire LS29 7QH UNITED KINGDOM , 44 01943865418 ,-
Incisive Wealth Strategies LLP,undefined50 Frankland Road Croxley Green   Rickmansworth Hertfordshire WD3 3AU UNITED KINGDOM , 44 01923710045 ,
Equilius Limited,undefined84 Brook Street    London  W1K 5EH UNITED KINGDOM , 44 02032912597 ,
The Falcon Group Limited,undefinedFairway House Hunns Mere Way Woodingdean  Brighton East Sussex BN2 6AH UNITED KINGDOM , 44 08000858590 ,www.lighthousegroup.plc.uk
Benjamin Parry,undefined8 Bridgeland Street    Bideford Devon EX39 2PZ UNITED KINGDOM , +44 01237472321 ,-
St. Mary's Private Wealth Limited,undefined26-28 Victoria Parade    London  SE10 9FR UNITED KINGDOM , 44 02039045235 ,www.spwinvestment.com
New Oak Wealth Management Limited,undefined8 Ashford Court Kirkburton   Huddersfield West Yorkshire HD8 0US UNITED KINGDOM , 44 01484603886 ,
Maitland Wealth Services Limited,undefinedBerkshire House 168-173 High Holborn   London  WC1V 7AA UNITED KINGDOM , 44 02030771234 ,
Odey Wealth Management (UK) Limited,undefined18 Upper Brook Street    London  W1K 7PU UNITED KINGDOM , 44 02072081400 ,http://www.odeywealth.com/
A.J. Wealth Management Limited,undefinedFirst Floor Office 9 High Street Tettenhall  Wolverhampton West Midlands WV6 8QS UNITED KINGDOM , 44 01902742921 ,
A&E Wealth Solutions Limited,undefined37 Hollyford    Billericay Essex CM11 1EG UNITED KINGDOM , 44 1277655337 ,www.david-golding.com
Hanbury Wealth Management Ltd,undefinedApex House 18 Hockerill Street   Bishop's Stortford Hertfordshire CM23 2DW UNITED KINGDOM , 44 1279466706 ,
Strategic Vision Wealth Ltd,undefinedClock Tower 2-4 High Street   Kidlington Oxon OX5 2DH UNITED KINGDOM , +44 01865664066 ,www.svwm.co.uk
Citypoint Wealth Limited,undefined25 Tyndrum Street    Glasgow Lanarkshire G4 0JY UNITED KINGDOM , 44 1413319605 ,
Darnells Wealth Management Ltd,undefinedQuay House Quay Road   Newton Abbot Devon TQ12 2BU UNITED KINGDOM , +44 01626358500 ,
Stuart Greenhill Wealth Management ltd,undefined19 Orton Road    Warwick  CV34 7AG UNITED KINGDOM , +44 7917676961 ,
Vizion Wealth LLP,undefined16 London House Swinfens Yard High Street Stony Stratford Milton Keynes Buckinghamshire MK11 1SY UNITED KINGDOM , 44 01908920043 ,www.vizionwealth.co.uk
SG Wealth Management,undefinedLow Galligill Nenthead   Alston Cumbria CA9 3LW UNITED KINGDOM , 44 01434684488 ,
Hall Wealth LLP,undefinedAyleworth Barn  Naunton  Cheltenham Gloucestershire GL54 3AH UNITED KINGDOM , 44 7980840794 ,
Heron Wealth Management Limited,undefined2 Alexandra Gate Ffordd Pengam   Cardiff South Glamorgan CF24 2SA UNITED KINGDOM , 44 02920472048 ,
DWS Alternatives Global Limited,undefinedThe Zig Zag Building 70 Victoria Street   London  SW1E 6SQ UNITED KINGDOM , +44 2075458000 ,
Revilot Wealth Management Ltd,undefined3 Spires Croft Shareshill   Wolverhampton West Midlands WV10 7JH UNITED KINGDOM , +44 01922410302 ,
DW Wealth Management Ltd,"undefinedQ16 Quorum Business Park, Benton Lane   Newcastle upon Tyne Tyne and Wear NE12 8BX UNITED KINGDOM ", 44 1912155470 ,www.dwwealthmangement.co.uk
Bespoke Wealth Solutions Limited,undefined53 Vansittart Road    Windsor Berkshire SL4 5DA UNITED KINGDOM , 44 1753358471 ,www.bespokewealthsolutions.com
DS Wealth Ltd,undefinedTamesis Islet Road   Maidenhead Berkshire SL6 8LD UNITED KINGDOM , 44 7768698741 ,
Celestial Wealth LLP,undefined65 Bridge Street    Castleford West Yorkshire WF10 1HH UNITED KINGDOM , 44 1977730441 ,www.celestialwealth.co.uk
Brett Jones,undefined23 Cashio Lane    Letchworth Garden City Hertfordshire SG6 1AY UNITED KINGDOM , 44 1462674210 ,
At Retirement Options Wealth Management Ltd,undefined15 Rosemoor Gardens Appleton   Warrington Cheshire WA4 5RF UNITED KINGDOM , 44 1925211187 ,
Global Wealth Management Solutions LLP,undefinedWrest Park  Silsoe  Bedford Bedfordshire MK45 4HR UNITED KINGDOM , 44 1525862420 ,www.globalwms.com
YVONNE GOODWIN WEALTH MANAGEMENT LIMITED,undefined75 Devonshire Avenue    Leeds West Yorkshire LS8 1AU UNITED KINGDOM , - 01133220037 ,www.yvonnegoodwin.co.uk
Ecclesall Wealth Management Ltd,undefined41 Bridge Street Killamarsh   Sheffield Derbyshire S21 1AH UNITED KINGDOM , 44 01143984124 ,
Sanctuary Wealth Planning Limited,undefinedThe Sanctuary Salisbury Road Plaitford  Romsey Hampshire SO51 6EE UNITED KINGDOM , 44 7557132672 ,
Treasurer Wealth Management LLP,undefined16 Zetland Avenue    Fort William Inverness-Shire PH33 6LL UNITED KINGDOM , 44 01397700376 ,
Portfolio Wealth Advice Limited,undefined107 Cheapside    London  EC2V 6DN UNITED KINGDOM , 44 2077968650 ,www.portfoliowealth.london
Primary Wealth Limited,undefined31 St. Bernards Road   Wylde Green Sutton Coldfield West Midlands B72 1LF UNITED KINGDOM , 44 1214068871 ,
Paige Wealth Management LLP,undefined7b Pepper St    Nantwich Cheshire CW5 5AB UNITED KINGDOM , 44 01270625254 ,-
Professional Financial LLP,undefinedBank Chambers 153-155 Holywood Road   Belfast County Antrim BT4 3BE UNITED KINGDOM , 44 02890655444 ,
Harvey Wickham,undefined59 Crondall Lane    Farnham Surrey GU9 7DG UNITED KINGDOM , 44 1252724074 ,www.meliorwealth.com
Khi Burgess,undefined24 Bright Street Cross Keys   Newport Gwent NP11 7PB UNITED KINGDOM , 44 01495273045 ,www.spectrumwealth.co.uk
Tailor - Made Wealth Management Limited,undefined12 Ronan Road Seskanore   Omagh  BT78 2QZ UNITED KINGDOM , +44 07921520294 ,
Sydney Charles UK LLP,undefined7 Old Aylesfield Buildings Froyle Road  Shalden Alton Hampshire GU34 4BY UNITED KINGDOM , 44 0142088664 ,-
Complete Wealth Management Limited,undefined49 Southlands Drive    London  SW19 5QJ UNITED KINGDOM , 44 01483902904 ,www.cwman.co.uk
Glennan Wealth Management Ltd,undefinedWest One 114 Wellington Street   Leeds West Yorkshire LS1 1BA UNITED KINGDOM , 44 01133884885 ,www.gwmfinancial.co.uk
Navigate Wealth Limited,undefined8 St. John Street    Manchester Lancashire M3 4DU UNITED KINGDOM , 44 7849204640 ,
ADMIRAL WEALTH MANAGEMENT LIMITED,undefined12 Dudley Street    Grimsby South Humberside DN31 2AB UNITED KINGDOM , 44 01472357035 ,
Divine Wealth Management Limited,undefined1 Huddleston Way Sawston   Cambridge Cambridgeshire CB22 3SW UNITED KINGDOM , 44 01223563915 ,-
London and Capital Wealth Advisers Limited,undefinedTwo Fitzroy Place 8 Mortimer Street   London  W1T 3JJ UNITED KINGDOM , 44 02073963200 ,http://www.londonandcapital.com/
Intelligent Wealth Management Partnership Ltd,undefinedWall House Green Lane  Wall  Lichfield Staffs WS14 0AS UNITED KINGDOM , 44 01543483700 ,-
Succeed Wealth Management Limited,undefinedGordon Street Mews 27-29 Gordon Street   Belfast County Antrim BT1 2LG UNITED KINGDOM , 44 2890311811 ,www.succeedwm.com
School Fees Investment Advisers Limited,undefined27 Moorbridge Road    Maidenhead Berkshire SL6 8LT UNITED KINGDOM , 44 1628566777 ,
French Duncan Wealth Management Ltd,undefined133 Finnieston Street    Glasgow  G3 8HB UNITED KINGDOM , 44 01412212984 ,frenchduncan.co.uk
Orchard Wealth Cultivation Limited,undefinedFilmers Barn Salts Lane Loose  Maidstone Kent ME15 0BD UNITED KINGDOM , 44 1622744012 ,
Lubbock Fine Wealth Management LLP,undefinedPaternoster House 65 St. Paul's Churchyard   London  EC4M 8AB UNITED KINGDOM , 44 2074907766 ,www.lfwm.co.uk
R & D Wealth Management Ltd,undefinedThe Waterfront First Floor East Suite Salts Mill Road  Shipley West Yorkshire BD17 7EZ UNITED KINGDOM , 44 1274028654 ,www.rdwm.uk
Chamberlain Wealth Management Limited,undefinedThe Seal Building 44 Blucher Street   Birmingham West Midlands B1 1QJ UNITED KINGDOM , 44 01216337218 ,
Wellway Wealth Management LLP,undefinedBorough Hall Wellway   Morpeth Northumberland NE61 1BN UNITED KINGDOM , +44 01670514433 ,
Ashleigh Court Private Client Wealth Management Ltd,undefinedSovereign House 12 Warwick Street   Coventry West Midlands CV5 6ET UNITED KINGDOM , 44 02476266495 ,www.ashleighcourt.com
Savvy Wealth Management Limited,undefined1 Parc Bryn Derwen Llanharan   Pontyclun Rhondda Cynon Taff CF72 9TT UNITED KINGDOM , +44 01443405583 ,www.savvywm.com
Green Wealth Management Ltd,undefined27 Lodge Lane Aston   Sheffield South Yorkshire S26 2BL UNITED KINGDOM , 44 1144428778 ,green-wealth.co.uk
Fields Macdonald Wealth Management Ltd,undefinedFields MacDonald Walth Management Ltd Suite 108 Westthorpe Business innovation Centre Westthorpe Fields Road Killamarsh Sheffield South Yorkshire S21 1TZ UNITED KINGDOM , - 01142180691 ,
Positive Wealth Creation Ltd,undefined55 Victoria Street    Burnham-on-Sea Somerset TA8 1AW UNITED KINGDOM , +44 01278788646 ,www.pwcltd.co.uk
Clear Wealth Management Ltd,undefinedSouthgate Business Centre 32 Gillygate   Pontefract West Yorkshire WF8 1PQ UNITED KINGDOM , 44 7534228077 ,www.clear-wealth.co.uk
Independent Wealth Management (UK) LLP,undefined15 The Knotches Seifton Batch   Craven Arms Shropshire SY7 9LQ UNITED KINGDOM , +44 01584861546 ,-
Inspire Wealth Solutions Ltd,undefinedSuite 2280 13 Freeland Park Wareham Road  Poole Dorset BH16 6FH UNITED KINGDOM , 44 1432281658 ,
Redwood Financial Family Wealth and Estate Planners Ltd,undefinedThe Rumpus St. Clairs Farm Wickham Road Droxford Southampton Hampshire SO32 3PW UNITED KINGDOM , 44 1489877547 ,www.redwoodfinancial.co.uk
JDW Wealth Management Ltd,undefined35 Vernon Road Poynton   Stockport Cheshire SK12 1LP UNITED KINGDOM , 44 1625871762 ,www.jdwwealthmanagement.co.uk
Intelligence Wealth Management Ltd,undefined20 Market Street    Altrincham Cheshire WA14 1PF UNITED KINGDOM , 44 1619273136 ,
Pennine Wealth Solutions LLP,"undefined2 Buckshaw Court,  East Terrace Business Park, Euxton Lane Euxton   Chorley Lancashire PR7 6TB UNITED KINGDOM ", 44 8447707721 ,www.penninewealthsolutions.co.uk
Red Kite Wealth Management Limited,undefined21 The Cedars Benson   Wallingford Oxfordshire OX10 6LL UNITED KINGDOM , +44 07714615051 ,www.redkitewm.co.uk
PPA Wealth Ltd,undefinedCarrwood Park Selby Road Swillington Common  Leeds West Yorkshire LS15 4LG UNITED KINGDOM , 44 01134931309 ,ppawealth.co.uk
