Company Name,Address,Phone,Website
Quantum Wealth Management Ltd,undefinedHammerain House Hookstone Avenue   Harrogate North Yorkshire HG2 8ER UNITED KINGDOM , 44 1423876336 ,
Premier Benefit Solutions Limited,undefinedAMP House Dingwall Road   Croydon  CR0 2LX UNITED KINGDOM , 44 02037279800 ,www.premiercompanies.co.uk
Sapphire Wealth Ltd,undefinedHillside The Orchard Stanedge Road  Bakewell Derbyshire DE45 1DG UNITED KINGDOM , 44 1629814485 ,
FS Wealth Management Limited,"undefinedNorth Wood Place Octagon Business Park, Hospital Road Little Plumstead  Norwich Norfolk NR13 5FH UNITED KINGDOM ", 44 1603595960 ,
Watts Mortgage & Wealth Management Ltd,undefinedUnit 9 George House Princes Court Beam Heath Way  Nantwich Cheshire CW5 6GD UNITED KINGDOM , 44 01270620555 ,www.watts-ifa.com
JWP Creers Wealth Management Ltd,undefinedApollo House Eboracum Way   York  YO31 7RE UNITED KINGDOM , 44 1904544300 ,
Dart Wealth Management Limited,undefined61 Robin Drive    Launceston Cornwall PL15 9LN UNITED KINGDOM , 44 01566772472 ,www.dartwealthmanagement.com
Minerva Money Management Limited,undefined17 Shirwell Crescent Furzton   Milton Keynes Buckinghamshire MK4 1GA UNITED KINGDOM , 44 1908592503 ,www.minervamoneymanagement.co.uk
Albion Wealth Solutions Limited,undefined27 Lambert Avenue Shurdington   Cheltenham Gloucestershire GL51 4SS UNITED KINGDOM , 44 01242701971 ,
Wealth Creation & Management Ltd,undefined34 Nea Road Highcliffe   Christchurch Dorset BH23 4NB UNITED KINGDOM , 44 01425613316 ,-
2 Plan Wealth Management Limited,undefined3rd Floor Bridgewater Place Water Lane  Leeds West Yorkshire LS11 5BZ UNITED KINGDOM , 44 08712203720 ,www.2plan.com
Plurimi Wealth LLP,undefinedTrafalgar House 11-12 Waterloo Place    London  SW1Y 4AU UNITED KINGDOM , 44 02074843340 ,www.plurimicapital.com
Grosvenor Wealth Management Limited,undefinedNine Waterside Station Road   Harpenden Hertfordshire AL5 4US UNITED KINGDOM , 44 02030304141 ,-
London Private Wealth Limited,undefinedUnit 1 Tay House 23 Enterprise Way  London  SW18 1FZ UNITED KINGDOM , 44 2071832555 ,www.privatewealth.co.uk
Crocus Wealth Limited,undefinedGround Floor 146 High Street   Billericay Essex CM12 9DF UNITED KINGDOM , 44 01277844595 ,www.crocuswealth.co.uk
HK Wealth Managers Ltd,undefinedForsyth House Lomond Court Castle Business Park  Stirling Stirlingshire FK9 4TU UNITED KINGDOM , 44 01786431760 ,www.hkwm.co.uk
Fortune Wealth Limited,undefined3 Greystoke Avenue    Pinner Middlesex HA5 5SH UNITED KINGDOM , 44 2081506664 ,
Neill Boulton Wealth Management Ltd,undefined66 Meols Parade    Wirral Merseyside CH47 5AX UNITED KINGDOM , +44 1516332714 ,
Aman Dhand,undefined988 Uxbridge Road    Hayes Middlesex UB4 0RL UNITED KINGDOM , 44 02088137979 ,
Hunter & Co (IFA) Limited,undefined46-48 Thornhill Road    Sutton Coldfield West Midlands B74 3EH UNITED KINGDOM , 44 01213534856 ,www.hunterwealth.co.uk
Cheltenham Wealth Financial Practice Ltd,undefined12-14 Rodney Road    Cheltenham Gloucestershire GL50 1JJ UNITED KINGDOM , 44 01242243357 ,
Investec Wealth & Investment Limited,undefined30 Gresham Street    London  EC2V 7QN UNITED KINGDOM , 44 2075971234 ,www.investecwin.co.uk
Oracle Wealth Ltd,undefinedWindsor House Cornwall Road   Harrogate North Yorkshire HG1 1SP ENGLAND , 44 01423323027 ,
Aspire Wealth Management Limited,undefined21 Lansdowne Crescent    Edinburgh Midlothian EH12 5EH UNITED KINGDOM ,   ,www.aspireifa.co.uk
Barkestone Associates (Wealth Management) Limited,"undefined30,The Green Barkestone   Nottingham Nottinghamshire NG13 0HH UNITED KINGDOM ", 44 01949844400 ,www.barkestoneassociates.com
QED Wealth Management Ltd,undefinedShortwood Cottage Gagley Lane Easton  Wells Somerset BA5 1AS UNITED KINGDOM , 44 08006122835 ,www.qedwm.com
Aspire Wealth (Scotland) Limited,undefined272 Bath Street    Glasgow Lanarkshire G2 4JR SCOTLAND , 44 7721834480 ,www.aspirewealthscotland.com
F.P. Consulting Limited,undefined3 Birch House Harris Business Park Hanbury Road Stoke Prior Bromsgrove  B60 4DJ UNITED KINGDOM , 44 01905612944 ,www.fp-consulting.co.uk
Yorkshire Wealth Management Ltd,undefined7 Feast Field Horsforth   Leeds West Yorkshire LS18 4TJ UNITED KINGDOM , +44 07818021272 ,
Wealthmasters Financial Management Ltd,undefinedAtlantic House Charnwood Park Waterton Bridgend  Mid Glamorgan CF31 3PL UNITED KINGDOM , 44 02038416881 ,
Multiplex Financial Trustees Limited,undefined5a York House York Street   Manchester M2 3BB M2 3BB ENGLAND , 44 01614138842 ,www.multiplex.org.uk
Asperand Wealth Limited,undefined40 Bloomsbury Way Lower Ground Floor London    WC1A 2SE UNITED KINGDOM , +44 02071128407 ,
Menzies Wealth Management Ltd,"undefinedLynton House, 1st Floor 7-12 Tavistock Square   London  WC1H 9LT UNITED KINGDOM ", +44 02073875868 ,www.menzieswm.co.uk
Signia Wealth Limited,undefined1 Connaught Place    London  W2 2ET UNITED KINGDOM , 44 2072986060 ,www.signiawealth.com
Client Centric Wealth Efficiency Service Limited,undefined2 Station Road    Chertsey Surrey KT16 8BE UNITED KINGDOM , 44 1932567079 ,www.clientcentricwealth.com
Mark Smith Wealth Management Ltd,undefined9 Station Road Sutton-on-Trent   Newark Nottinghamshire NG23 6QF UNITED KINGDOM , 44 01636822126 ,-
Fidra Wealth Management Ltd,undefinedThe Sycamores Grange Road   North Berwick East Lothian EH39 4QU UNITED KINGDOM , 44 01620890588 ,
SMB Wealth Management Ltd,undefined81a Marlowes    Hemel Hempstead Herts HP1 1LF UNITED KINGDOM , 44 1442260884 ,www.smbwealth.co.uk
Wisley Family Wealth Limited,,,
Cheshire Wealth Management Ltd,undefined62 Westgate Hale   Altrincham Cheshire WA15 9AZ UNITED KINGDOM , 44 01612330388 ,www.cheshirewealth.com
Competitive Edge Wealth Creation Ltd,undefined4b Wellhouse Road Beech   Alton Hampshire GU34 4AH UNITED KINGDOM , 44 1420543698 ,
Sentient Wealth Management LTD,undefined17 Silverdale Road Petts Wood   Orpington Kent BR5 1NH UNITED KINGDOM , 44 1689826112 ,www.sentientwealth.com
Leadenhall Wealth Management Ltd,undefinedLevel 30 The Leadenhall Building 122 Leadenhall Street  London  EC3V 4AB UNITED KINGDOM , +44 2037534645 ,https://www.leadenhallwm.com
Professional Wealth Planning Limited,undefined11f Lancaster Crescent    Glasgow Lanarkshire G12 0RR UNITED KINGDOM , +44 1413535087 ,-
Aidan Dow Wealth Management Limited,undefined78 York Street    London  W1H 1DP UNITED KINGDOM , 44 7989588442 ,www.aidandowwealthmanagement.com
Dolphin Wealth Management Ltd,undefined31 Beacon Road    Broadstone  BH18 9JP UNITED KINGDOM , 44 07977496179 ,
The Wealth Care Partnership Limited,"undefined7 Glasshouse Studios, Fryern Court Road Burgate   Fordingbridge Hampshire SP6 1QX UNITED KINGDOM ", 44 01425653263 ,www.thewealthcarepartnership.co.uk
AKFP Ltd,undefinedBuilding 2 The Sidings Antrim Road  Lisburn County Antrim BT28 3AJ UNITED KINGDOM , 44 02892603175 ,www.akfp.net
Mark Sessions Wealth Management Ltd,undefined26 Matlock Road    Brighton East Sussex BN1 5BF UNITED KINGDOM , +44 01273562451 ,
Alban Wealth LLP,undefinedBox 791 St Albans Wheathampstead  St. Albans Hertfordshire AL4 8XG UNITED KINGDOM , 44 1727220321 ,paulacohen.co.uk
Key Wealth Management Limited,undefined47 Ivy Lane    Macclesfield Cheshire SK11 8NU UNITED KINGDOM , 44 01625428791 ,
Freedom Wealth LLP,undefinedSpringfields  Tivington  Minehead Somerset TA24 8SU UNITED KINGDOM , 44 1643707590 ,
Advantage Wealth Management Ltd,undefinedGround Floor 65 Sinclair Street   Helensburgh Dunbartonshire G84 8TG UNITED KINGDOM , 44 1436679634 ,www.advantagewealthmanagement.co.uk
Independence Wealth Management Limited,undefinedThe House of Owls Buryas Bridge   Penzance Cornwall TR19 6AS UNITED KINGDOM , 44 08709220421 ,www.independencewealth.eu
Coast & Country Wealth Management Limited,undefined10 Gobannium Way Ysbytty Fields   Abergavenny Gwent NP7 9JA UNITED KINGDOM , 44 1873859878 ,coastandcountrywealth.com
Chattertons Wealth Management Limited,undefined9 Broad Street    Stamford Lincolnshire PE9 1PY UNITED KINGDOM , 44 1780764145 ,www.chattertons.com
Philippa Gee Wealth Management Limited,undefined8 High Street    Church Stretton Shropshire SY6 6BU UNITED KINGDOM , 44 01694722222 ,www.philippagee.co.uk
Robson Laidler Financial Planning Limited,undefinedFernwood House Fernwood Road Jesmond  Newcastle upon Tyne Tyne and Wear NE2 1TJ UNITED KINGDOM , - 01912818191 ,www.robson-laidler.co.uk/wealth
Diem Marshall Wealth Management Limited,undefinedThe Stables The Green Stadhampton  Oxford Oxfordshire OX44 7UW UNITED KINGDOM , 44 7909966307 ,
MC Financial Wealth Management Ltd,undefinedAxis House Stock Road   Chelmsford Essex CM2 8PW UNITED KINGDOM , +44 1245603656 ,
Prospero Wealth Management Services LLP,undefined1 Russet Way    Alderley Edge  SK9 7RW UNITED KINGDOM , 44 01625584749 ,
Ten Wealth Management Limited,undefined16 Poplars Court Lenton Lane   Nottingham  NG7 2RR UNITED KINGDOM , +44 01159701610 ,www.tenwealth.co.uk
Knightsbridge Wealth Management (NI) Ltd,undefinedLynden Gate 50 Knockbreda Road   Belfast  BT6 0JB UNITED KINGDOM , +44 02890382744 ,www.knightsbridgewm.com
LFS & Partners Limited,undefinedA F H House Buntsford Drive Stoke Heath  Bromsgrove Worcestershire B60 4JE UNITED KINGDOM , 44 1527577775 ,www.afhwm.co.uk
One Life Wealth Planning Ltd,undefinedMosquito Way    Hatfield Hertfordshire AL10 9AX UNITED KINGDOM , +44 01707262541 ,www.onelifewealth.co.uk
JLT Benefit Solutions Ltd,undefinedThe St Botolph Building 138 Houndsditch   London  EC3A 7AW UNITED KINGDOM , 44 02073098100 ,-
Tavistock Wealth Limited,undefined1 Bracknell Beeches Old Bracknell Lane   Bracknell  RG12 7BW UNITED KINGDOM , 44 1753867000 ,www.tavistockwealth.com
Bluegrove Wealth Limited,undefined20A Moreton Avenue    Harpenden Hertfordshire AL5 9FP UNITED KINGDOM , 44 1582461961 ,www.bluegrove.co.uk
Kevin James Smith Wealth Managers LLP,"undefined21 Glanymor Park Drive, Glanymor Park Loughor   Swansea West Glamorgan SA4 6UQ UNITED KINGDOM ", 44 1792527168 ,
RMC Wealth Management LLP,undefined21 Harrington Drive    Bedford Bedfordshire MK41 8DB UNITED KINGDOM , +44 01234390556 ,www.rmcwealth.co.uk
Stepping Stones Wealth Management Ltd,undefined27 Merthyr Mawr Road The Coach House   Bridgend Mid Glamorgan CF31 3NN UNITED KINGDOM , 44 01656663211 ,-
Saal Wealth Management Ltd,undefinedKingsmill  Castlemartin  Pembroke Dyfed SA71 5HE UNITED KINGDOM , 44 3333220166 ,
PSP Wealth Management Ltd,undefined181-183 Ford Green Road    Stoke-on-Trent Staffordshire ST6 1PF UNITED KINGDOM , 44 01782830005 ,www.pspwm.co.uk
Continuum Wealth Limited,undefinedTaylor House 39 High Street Marlow Bucks   SL7 1AU UNITED KINGDOM , 44 1628947347 ,
Arundel Wealth Management Limited,undefinedThe Atrium Curtis Road   Dorking Surrey RH4 1XA UNITED KINGDOM , 44 03456434051 ,www.arundelwealth.co.uk
Griffin Wealth Management Limited,undefined2 Nicholas Street Mews    Chester Cheshire CH1 2NS UNITED KINGDOM , +44 1244311971 ,
Storrs Wealth Planning Limited,undefinedStorrs Hall Bungalow  Ingleton  Carnforth Lancashire LA6 3AN UNITED KINGDOM , 44 1524241824 ,www.storrswealthplanning.co.uk
Clarity Wealth Limited,undefined8 Kerry Street Horsforth   Leeds West Yorkshire LS18 4AW UNITED KINGDOM , 44 1132586000 ,
McLaren Wealth Management UK Limited,undefinedAbbotsmere Tilford Road Tilford  Farnham Surrey GU10 2DD UNITED KINGDOM , +44 02081338070 ,www.mclarenwealthmanagement.com
MKC Wealth Ltd,undefined10-13 Lovat Lane    London  EC3R 8DN UNITED KINGDOM , 44 02077024488 ,-
Dawn Slater Wealth Management Ltd,undefined27A Kingfisher Court   Newbury Berkshire RG14 5SJ UNITED KINGDOM , 44 1635551926 ,www.dawnslater.co.uk
Achieve Wealth Management (Wiltshire) Ltd,undefined42 Grange Drive    Swindon Wiltshire SN3 4LD UNITED KINGDOM , 44 1793825447 ,
Brancaster House Limited,undefined30 Cattle Market Street    Norwich Norfolk NR1 3DY UNITED KINGDOM , 44 01603633344 ,www.brancasterhouse.co.uk
Armstrong Financial Planning Limited,undefinedTrinity House 15 Cross Street Standish  Wigan Lancashire WN6 0HQ UNITED KINGDOM , 44 1257425544 ,www.afpwealth.com
Collingbourne Wealth Management Ltd,undefined45 Southgate Street    Winchester Hampshire SO23 9EH UNITED KINGDOM , 44 1962659144 ,collingbourne.com
Carrington Wealth Management LLP,undefined27 Donegall Street    Belfast County Antrim BT1 2FG UNITED KINGDOM , 44 02890333322 ,www.carringtonwealth.com
Callisto Wealth Management Ltd,undefinedRainford Hall Crank Road Crank  St. Helens Merseyside WA11 7RP UNITED KINGDOM , 44 01744881421 ,www.callistowealth.co.uk
DATA Wealth Management LLP,undefinedCourtyard Barn Binham Road Langham  Holt Norfolk NR25 7AB UNITED KINGDOM , 44 01328830167 ,
Wigmore Associates Wealth Management Ltd,undefined20 Seymour Mews    London  W1H 6BQ UNITED KINGDOM , +44 2072243400 ,
Gravel Hill Wealth Management LLP,undefinedGravel Hill House Gravel Hill Wombourne  Wolverhampton West Midlands WV5 9HA UNITED KINGDOM , 44 01902898555 ,www.gravelhillwm.co.uk
Jamieson Christie Wealth Management Limited,undefinedRegent House 430-432 Kenilworth Road Balsall Common  Coventry West Midlands CV7 7DN UNITED KINGDOM , 44 01676532210 ,www.jamiesonchristie.com
Greenhill Wealth Management Limited,undefined1 Harestones Wynyard   Billingham Durham TS22 5QT UNITED KINGDOM , 44 01740617262 ,www.greenhillwealth.co.uk
Strategy Wealth Management Limited,undefined22 Old Towns Close Tottington   Bury Lancashire BL8 3LH UNITED KINGDOM , 44 1204886575 ,www.strategywealth.co.uk
Medical Insurance and Advisory Service,undefined9 Cromwell Court St. Peters Street   Ipswich Suffolk IP1 1XB UNITED KINGDOM , 44 01473250063 ,
Greystone Financial Services Limited,undefinedFoundation House Scott Drive   Altrincham Cheshire WA15 8AB UNITED KINGDOM , 44 01619277222 ,www.greystonefs.co.uk
GilesSmith Wealth Management LLP,undefined27 East Street    Chichester West Sussex PO19 1HS UNITED KINGDOM , 44 1903722111 ,
Howard Wealth Management Limited,"undefinedHoward Wealth Management Ltd Fareham Innovation Centre Office 18, Merlin House 4 Meteor Way Lee-On-The-Solent Hampshire PO13 9FU UNITED KINGDOM ", 44 02393877630 ,www.howardwealth.com
Juno Wealth Management Limited,"undefinedUnit 1B Stairbridge Court, Stairbridge Lane Bolney  Haywards Heath West Sussex RH17 5PA UNITED KINGDOM ", 44 1444237820 ,www.junowealth.co.uk
UBS AG,undefined5 Broadgate    London  EC2M 2QS UNITED KINGDOM , 44 02075678000 ,
Berkley Wilkinson Wealth Management Ltd,undefined2 Briar Edge    Newcastle upon Tyne Tyne and Wear NE12 7JN UNITED KINGDOM , 44 1912667595 ,
GJS Wealth Management Ltd,undefinedGJS House 11 Cecil Street   Stalybridge Cheshire SK15 2LD UNITED KINGDOM , 44 1613038008 ,http://www.gjswm.org/
Banks Wealth Management Limited,undefinedThe Old Bank 77 Railway Road Brinscall  Chorley Lancashire PR6 8RJ UNITED KINGDOM , 44 125483096 ,www.bankswealth.co.uk
Retirement Planning Partnership Limited,undefinedKestrel House Alma Road   Romsey Hampshire SO51 8ED UNITED KINGDOM , 44 01794517066 ,www.trpp.co.uk
Elevation Investment Management Ltd,"undefinedUnit 1 Marlin Office Village, 1250 Chester Road Castle Vale  Birmingham West Midlands B35 7AZ UNITED KINGDOM ", 44 1214110488 ,http://www.elevation-im.co.uk/
MM Wealth Ltd,"undefinedM M Wealth Ltd, Unit 1 Wellbrook Court Girton  Cambridge Cambridgeshire CB3 0NA UNITED KINGDOM ", 44 01223233331 ,www.mmwealth.co.uk
Financial Therapeutics UK Ltd,undefined32 Park Cross Street    Leeds West Yorkshire LS1 2QH UNITED KINGDOM , +44 01134032917 ,-
Primera Wealth Management Limited,undefinedOffice E Dutch Barn Ford End  Chelmsford Essex CM3 1LN UNITED KINGDOM , 44 1245847900 ,www.primerawealthmanagement.co.uk
Fiducia Wealth Management Limited,undefinedDedham Hall Business Centre Brook Street Dedham  Colchester Essex CO7 6AD UNITED KINGDOM , 44 01206321045 ,www.fiduciawealth.co.uk
Harpsden Wealth Management Limited,undefinedNewtown House Newtown Road   Henley-on-Thames Oxfordshire RG9 1HG UNITED KINGDOM , +44 01491570820 ,www.harpsden.com
Informed Wealth Strategies Ltd,undefined68 Lombard Street    London  EC3V 9LJ UNITED KINGDOM , 44 02074505336 ,
Harrogate Wealth Management Limited,undefinedWindsor House Cornwall Road   Harrogate  HG1 2PW UNITED KINGDOM , 44 7969568380 ,
Pragma Wealth Management Limited,undefined12a Eccleston St    London  SW1W 9LT UNITED KINGDOM , 44 02072274769 ,-
Hawsons Wealth Management Limited,undefinedPegasus House 463a Glossop Road   Sheffield South Yorkshire S10 2QD UNITED KINGDOM , 44 01142296557 ,
Argent Wealth Limited,undefinedEvolve Building Cygnet Way Rainton Bridge Business Park  Houghton le Spring Tyne & Wear DH4 5QY UNITED KINGDOM , +44 01915173344 ,-
Generation Wealth Ltd,undefinedLower Bowdens Farm Bowdens Lane Shillingford  Tiverton Devon EX16 9BU UNITED KINGDOM , 44 1392950960 ,www.generationwealth.co.uk
Artorius Wealth Management Limited,"undefinedMichael Toole, 2nd Floor, The Boardwalk 21 Little Peter Street   Manchester  M15 4PS UNITED KINGDOM ", 44 1617110730 ,
PairsTech Capital Management LLP,"undefinedNorvin House, 45-55 Commercial St.  London  London  E1 6BD UNITED KINGDOM ", 44 02075393771 ,-
Holroyd & Co Wealth Management Limited,undefined27 Market Street Milnsbridge   Huddersfield West Yorkshire HD3 4ND UNITED KINGDOM , 44 1484645464 ,
Aspen Wealth Management,undefinedThe Pension Advice Centre 16 Cross Street   Ryde Isle of Wight PO33 2AD UNITED KINGDOM , 44 1983810230 ,
Executive Wealth Management Limited,undefinedGroundwell Farmhouse Woodcutters Mews   Swindon Wiltshire SN25 4AU UNITED KINGDOM , 44 01793976162 ,
JB Wealth Management Limited,undefined41 The Broadway Cheam Village   Sutton Surrey SM3 8BL UNITED KINGDOM , 44 02086617222 ,www.jbwm.co.uk
HAMNETT WEALTH MANAGEMENT LIMITED,undefined160 Baslow Road    Sheffield South Yorkshire S17 4DR UNITED KINGDOM , 44 01142353500 ,
Legacy Private Wealth Limited,undefined5th Floor Quay Gate House 15 Scrabo Street  Belfast  BT5 4BD UNITED KINGDOM , 44 2890454300 ,www.legacyprivatewealth.co.uk
Quantum Wealth Planning Ltd,undefined50A St. Johns Road    Tunbridge Wells Kent TN4 9NY UNITED KINGDOM , 44 01892519428 ,www.qwplanning.co.uk
Capital Wealth Partners Limited,undefinedRegus Building Central Boulevard Blythe Valley Park Shirley Solihull West Midlands B90 8AG UNITED KINGDOM , 44 08443386622 ,
Wellington Wealth (Glasgow) Limited,undefined5th Floor Gordon Chambers 90 Mitchell Street  Glasgow  G1 3NQ UNITED KINGDOM , 44 1412213222 ,www.wellington-wealth.com
Pioneer Wealth Management Limited,undefinedThe Retreat Laregan Hill   Penzance Cornwall TR18 4NY UNITED KINGDOM , 44 01736603726 ,
Elite-Wealth Management UK Ltd,undefinedChy An Brea Hea Road  Heamoor  Penzance Cornwall TR18 3HB UNITED KINGDOM , 44 01736360740 ,wwww.elite-wealthmanagement.co.uk
Wealth Generation LLP,undefined22 Church Road Business Centre Church Road   Sittingbourne Kent ME10 3RS UNITED KINGDOM , 44 1795479707 ,
Consilium Wealth Limited,undefinedOrion House 14 Barn Hill   Stamford Lincolnshire PE9 2AE UNITED KINGDOM , 44 01780758523 ,
Sheards Wealth Management Limited,undefinedVernon House 40 New North Road   Huddersfield West Yorkshire HD1 5LS UNITED KINGDOM , 44 01484448019 ,
Prudent Wealth Management Limited,undefined64 Canaan Lane    Edinburgh Midlothian EH10 4SG UNITED KINGDOM , 44 01312080666 ,
Nexus Wealth Planning Ltd,undefined12A Fitzroy Place    Glasgow  G3 7RW UNITED KINGDOM , 44 01414382275 ,www.nexuswp.co.uk
Bonum Wealth Ltd,undefinedRegent House 113 West Regent Street   Glasgow Lanarkshire G2 2RU UNITED KINGDOM , 0141 2216398 ,www.bonumwealth.co.uk
The Wealth Group Limited,undefined15 Queens Road   Evesham Worcestershire WR11 4JN UNITED KINGDOM , 44 01386442597 ,www.wealth-group.co.uk
Personal Wealth Management (South Wales) Ltd,undefined20 High Street Newbridge   Newport Caerffili NP11 4EZ UNITED KINGDOM , +44 01633746278 ,www.pwmfinancial.co.uk
Perspective (South) Limited,undefined3 Whittle Court Seebeck Place Knowlhill  Milton Keynes Bucks MK5 8FT UNITED KINGDOM , 44 01908257888 ,www.pfgl.co.uk/south
Millcroft Wealth Management Limited,undefined8 Oxford Court    Manchester Lancashire M2 3WQ UNITED KINGDOM , 44 01613022401 ,www.millcroftwm.co.uk
Chris Binns Wealth Management Limited,undefinedBlake House 18 Blake Street   York  YO1 8QG UNITED KINGDOM , 44 1759372346 ,www.modelwealthmanagement.com
Vertis Private Wealth Management Limited,undefinedCampion House Green Street   Kidderminster Worcestershire DY10 1JL UNITED KINGDOM , 44 01562751010 ,www.vpwm.co.uk
Pro-Synergy Wealth & Tax Management Ltd,undefinedTrinity House 33a Market Street   Lichfield Staffordshire WS13 6LA UNITED KINGDOM , 44 1543404618 ,www.pro-synergy.co.uk
Explore Wealth Management Limited,undefinedExplore House 7 Berrymoor Court Northumberland Business Park Cramlington Northumberland  NE23 7RZ UNITED KINGDOM , 44 1912851555 ,www.explorewealth.co.uk
Advice & Wealth Management Solutions LLP,undefined272 Bath Street    Glasgow Lanarkshire G2 4JR UNITED KINGDOM , 44 01413541535 ,
RXI Wealth Ltd,undefinedClaydon Court Old Ipswich Road Claydon  Ipswich Suffolk IP6 0AE UNITED KINGDOM , +44 02071128657 ,rxiwealth.com
Kingsbridge Wealth Management Ltd,undefined10 Kingsbridge Copse Newnham   Hook Hampshire RG27 9AP UNITED KINGDOM , 44 7788295848 ,www.kingsbridgewealth.co.uk
Hampstead Wealth Management Ltd,undefined843 Finchley Road    London  NW11 8NA UNITED KINGDOM , 44 02082099299 ,www.hampsteadwealth.co.uk
Genesis Wealth Management Ltd,undefinedBartle House Oxford Court   Manchester  M2 3WQ UNITED KINGDOM , 44 01619149230 ,www.generatewealth.co.uk
Private Wealth Mortgages Limited,undefinedSuite 3 Hillreed House 54 Queen Street  Horsham West Sussex RH13 5AD UNITED KINGDOM , 44 1403270006 ,www.privatewealthmortgages.co.uk
Northfield Wealth Limited,undefined46 Windsor Street Burbage   Hinckley Leicestershire LE10 2EF UNITED KINGDOM , 44 1455886328 ,www.northfieldwealth.co.uk
Stratagem Wealth Limited,undefined1 Park Lane    Poynton Cheshire SK12 1RD UNITED KINGDOM , 44 1614644000 ,www.stratagemwealth.co.uk
More Wealth Planning Ltd,undefinedThe Mill House Boundary Road   High Wycombe Buckinghamshire HP10 9QN UNITED KINGDOM , 44 1628819473 ,www.morewealthplanning.co.uk
Halen Wealth Limited,undefinedThe Old Vicarage  Llancarfan  Barry South Glamorgan CF62 3AJ UNITED KINGDOM , 44 7577689826 ,www.halenwealth.co.uk
AD Wealth Limited,undefinedWest One 114 Wellington Street   Leeds West Yorkshire LS1 1BA UNITED KINGDOM , +44 01132123546 ,www.adwealth.co.uk
HYWIN WEALTH LLP,undefinedHywin Wealth LLP 105 Piccadilly   London  W1J 7NJ UNITED KINGDOM , +44 02036422510 ,www.hywinwealth.co.uk
OSL Financial Consultancy Limited,undefined109 Ferriby Road    Hessle East Riding of Yorkshire HU13 0JA UNITED KINGDOM , 44 1482306666 ,www.mortagekey.co.uk
Morrison Personalised Wealth Management Ltd,undefined80 Avontoun Park    Linlithgow West Lothian EH49 6QQ UNITED KINGDOM , 44 7789637482 ,
Apogee Wealth Management Limited,undefinedNo.1 Booths Park Chelford Road   Knutsford Cheshire WA16 8GS UNITED KINGDOM , 44 01565757811 ,www.apogeewealth.co.uk
Cadde Wealth Management Limited,"undefinedUnit 10 Chevron Business Park, Limekiln Lane Holbury  Southampton Hampshire SO45 2QL UNITED KINGDOM ", 44 2380892111 ,cadde.co.uk
Delaunay Wealth Management Ltd,undefinedHolden House 57 Rathbone Place   London  W1T 1JU UNITED KINGDOM , 44 3455053500 ,www.delaunaywealth.com
Verum Wealth Ltd,undefined5th Floor - Gordon Chambers 90 Mitchell Street   Glasgow Lanarkshire G1 3NQ UNITED KINGDOM , 44 1412267860 ,
Brigham Wealth Management LLP,undefinedSceptre House 8 Hornbeam Square North   Harrogate North Yorkshire HG2 8PB UNITED KINGDOM , 44 01423810210 ,
TTR Barnes (Financial Services) Limited,undefined3-5 Grange Terrace Stockton Road   Sunderland Tyne and Wear SR2 7DG UNITED KINGDOM , 44 01915661984 ,www.key-wealth.com
Orion Wealth LLP,undefinedRoyalty House 32 Sackville Street   London  W1S 3EA UNITED KINGDOM , 44 02074345777 ,
Direct Wealth Management Limited,"undefinedUnit GF 3A John Long Trade Park 29, Ystrad Road Fforestfach Swansea  SA5 4LH UNITED KINGDOM ", 44 7974141797 ,
Chapter Wealth Management Ltd,undefined2c Kirkgate Waltham   Grimsby South Humberside DN37 0LS UNITED KINGDOM , 44 1472825757 ,www.chapterwealth.com
MPL Wealth Management Limited,undefined45 Doughty Street    London  WC1N 2LR UNITED KINGDOM , 44 02078314711 ,www.mplwealthmanagementlimited.co.uk
GSI Wealth Management Limited,undefined1 Churchill Court Hortons Way   Westerham Kent TN16 1BT UNITED KINGDOM , 44 01959561500 ,www.gsigroup.co.uk
Absolute Wealth Management Ltd,undefined41 North View  Westbury Park  Bristol  BS6 7PY UNITED KINGDOM , 44 01179071965 ,www.absolutewm.co.uk
Spectrum Wealth Management Ltd,undefinedSuite 3 Davidson House Glenavy Road Business Park 20 Glenavy Road Moira Armagh BT67 0LT NORTHERN IRELAND , 44 02838897012 ,
Bluesky Independent Wealth Managers Ltd,undefined1 Simonsburn Road Loreny Industrial Estate   Kilmarnock Ayrshire KA1 5LA UNITED KINGDOM , 44 01563590037 ,www.wealthatbluesky.com
Libertas Wealth Management Ltd,undefinedThe Barns Stretton Road Stretton  Warrington Cheshire WA4 4NP UNITED KINGDOM , 44 1619804686 ,www.libertaswm.co.uk
Murphy Wealth Limited,undefinedSutherland House 149 St. Vincent Street   Glasgow Lanarkshire G2 5NW UNITED KINGDOM , 44 1412215353 ,
Richmond Wealth LLP,undefined41 Lothbury    London  EC2R 7HG UNITED KINGDOM , 44 2081332344 ,www.richmondwealth.co.uk
Gresham Wealth Management (FS) Ltd,undefinedCecil Court 28-36 Cecil Road Hale  Altrincham Cheshire WA15 9PB UNITED KINGDOM , 44 01619739150 ,www.greshamwm.co.uk
RJM Health And Wealth Solution Ltd.,undefined15a dorothy avenue thurmaston   leicester leicestershire LE4 8AB UNITED KINGDOM , +44 01162102523 ,www.saladmaster.co.uk/rjm-health-wealth-solutions
Aptus Wealth Limited,"undefined2nd Floor, 5 Glynde Place    Horsham West Sussex RH12 1NZ UNITED KINGDOM ", 44 1403732534 ,www.aptuswealth.co.uk
HB Cranfield Wealth Management Limited,undefined62 Lower Street    Pulborough West Sussex RH20 2BW UNITED KINGDOM , 44 01798872323 ,
