Company Name,Address,Phone,Website
Age Partnership Wealth Management Limited,"undefined2200 Century Way, Thorpe Park    Leeds West Yorkshire LS15 8ZB UNITED KINGDOM ", 44 8080555222 ,www.agepartnership.com
Johnston Carmichael Wealth Limited,undefinedBishops Court 29 Albyn Place   Aberdeen Aberdeenshire AB10 1YL UNITED KINGDOM , +44 1224259373 ,www.jcwealth.co.uk
TW11 Wealth Management Ltd,undefined8 Waldegrave Road    Teddington Middlesex TW11 8HT UNITED KINGDOM , 44 2031110589 ,www.hatchplan.co.uk
Blue Fox Wealth Management Limited,undefinedUnit 2 Holt Mill Melbury Osmond  Dorchester Dorset DT2 0XL UNITED KINGDOM , 44 1935507230 ,www.bluefoxwealth.co.uk
Cowgills Wealth Limited,undefined45-51 Chorley New Road   Bolton Lancashire BL1 4QR UNITED KINGDOM , 44 1204414243 ,www.cowgills.co.uk/services/wealth-management
Blueberry Wealth Limited,undefinedSuite A 5a Widcombe Street Poundbury  Dorchester Dorset DT1 3BS UNITED KINGDOM , 44 1305753634 ,
Goldstone Wealth Management Ltd,undefined17 Morton Drive Dalrymple   Ayr Ayrshire KA6 6QA UNITED KINGDOM , 44 7773139418 ,
Roxborough Wealth Management Limited,undefinedBewley House Park Road   Esher Surrey KT10 8NP UNITED KINGDOM , 44 01932825233 ,www.roxborough.uk.com
Chetwood Wealth Management Ltd,undefined60 High St    Wellington Somerset TA21 8RD UNITED KINGDOM , 44 01823666809 ,www.chetwoodwm.co.uk
Ellis Bates Wealth Management Limited,undefinedAdam House Ripon Way   Harrogate North Yorkshire HG1 2AU UNITED KINGDOM , 44 1423520052 ,
Mackenzie Taylor Wealth Management Limited,undefined53 Culduthel Mains Gardens  Culduthel  Inverness Inverness-shire IV2 6RD UNITED KINGDOM , 44 01667459990 ,-
Callidus Wealth Management Ltd,undefined21 Young Street    Edinburgh Midlothian EH2 4HU UNITED KINGDOM , 44 1313444621 ,
Wealth Ideas Limited,undefined43 Quakers Lane    Potters Bar Hertfordshire EN6 1RH UNITED KINGDOM , 44 1707661040 ,www.wealthideas.co.uk
Progeny Wealth Limited,undefinedProgeny House 46 Park Place   Leeds West Yorkshire LS1 2RY UNITED KINGDOM , 44 1132449737 ,www.progenywealth.co.uk
Succession Wealth Management Ltd,"undefinedUnit 9 The Drake Building, 15 Davy Road Derriford  Plymouth Devon PL6 8BY UNITED KINGDOM ", 44 01752762140 ,www.successionwealth.co.uk
Westminster Wealth Management LLP,"undefined4th Floor, Chronicle House 72-78 Fleet St   London  EC4Y 1HY UNITED KINGDOM ", +44 02074005860 ,www.westminster-wealth.com
Bartholomew Hawkins Asset Management Ltd,"undefinedUnit 5 Oak Tree Court, Mulberry Drive Cardiff Gate Business Park, Pontprennau  Cardiff South Glamorgan CF23 8RS UNITED KINGDOM ", 44 2920508000 ,
Citywide Wealth Ltd,undefined411 Lisburn Road    Belfast County Antrim BT9 7EW UNITED KINGDOM , 44 7795202650 ,
Barry W P Bennett Limited,undefinedBennett Wealth Planning Ground Floor Woburn House The Rock Complex Yelverton Devon PL20 6BS UNITED KINGDOM , 44 1822855060 ,www.bennettwealthplanning.com
KW Wealth Planning Limited,undefined13 Austin Friars   London  EC2N 2HE UNITED KINGDOM , 44 2072930730 ,www.kw-wealth.com
Centurion Wealth Management Limited,undefined25 Church Farm Business Park Corston   Bath Avon BA2 9AP UNITED KINGDOM , 44 1225308330 ,www.centurioncfp.co.uk
Access Wealth Management,undefinedThe Beacon Beaufront Park Anick Road  Hexham Northumberland NE46 4TU UNITED KINGDOM , 44 1661853838 ,www.accesswm.co.uk
Forty Two Financial Planning Limited,undefined1st Floor Lochinch House 86 Dumbreck Road  Glasgow Lanarkshire G41 4SN UNITED KINGDOM , 44 1414041501 ,www.fortytwofp.com
Corville Financial Services Ltd,undefinedAFH House Buntsford Drive Stoke Heath  Bromsgrove Worcestershire B60 4JE UNITED KINGDOM , 44 01527577775 ,www.afhwm.co.uk
Vintage Wealth Management Limited,undefinedFairchild House Redbourne Avenue Finchley  London  N3 2BP UNITED KINGDOM , 44 02083713111 ,www.vintagewealthmanagement.co.uk
APL Wealth Management Limited,undefinedGarth Ellen Twthill East   Caernarfon Gwynedd LL55 1PF UNITED KINGDOM , +44 1286672124 ,
JNH Wealth Management Limited,"undefined1st Floor, Swan Petroleum  Babbinswood, Whittington  Oswestry Shropshire SY11 4PQ UNITED KINGDOM ", 44 1691656003 ,
Advanta Wealth Ltd,undefinedLower Ground 130 Buckingham Palace Road   London  SW1W 9SA UNITED KINGDOM , 44 2036687480 ,www.advantawealth.co.uk
Clarity Wealth Management Solutions Ltd,undefined35 Tiger Close Woodley   Reading Berkshire RG5 4UY UNITED KINGDOM , 44 1189691800 ,
Rook Wealth Limited,undefinedRise London 41 Luke Street   London  EC2A 4DP UNITED KINGDOM , 44 7866774967 ,www.multiply.ai
JLT Wealth Management Limited,undefinedThe St Botolph Building 138 Houndsditch   London  EC3A 7AW UNITED KINGDOM , 44 02073098100 ,-
Vision Financial Strategies Ltd,undefined4-5 Brambles Business Centre 14 Somerset House Hussar Court Westside View Waterlooville Hampshire PO7 7SG UNITED KINGDOM , 44 02392233073 ,
Courtlands Wealth Planning Ltd,undefined47 Blandford Avenue    Oxford Oxfordshire OX2 8EB UNITED KINGDOM , 44 1865570260 ,www.courtlandswealth.co.uk
West Midlands Wealth Management Ltd,undefined56 Sandles Road    Droitwich Worcestershire WR9 8RA UNITED KINGDOM , 44 7713763593 ,www.wmwm.org.uk
Bond Wealth Ltd,undefined2nd Floor Eastcheap Court 11 Philpot Lane  London  EC3M 8AA UNITED KINGDOM , +44 02030963386 ,www.bondwealth.co.uk
Ferguson Oliver Limited,undefined26 Clerk Street    Brechin Angus DD9 6AY UNITED KINGDOM , +44 1356625285 ,www.fowm.co
Wealthflow LLP,undefinedAbbey House 83 Princes Street   Edinburgh Midlothian EH2 2ER UNITED KINGDOM , 44 01312476745 ,www.wealthflow.com
PFP Wealth Management LLP,undefined6 Grosvenor Street    London  W1K 4PZ UNITED KINGDOM , +44 02031962900 ,
Goldsborough Wealth Limited,undefinedSpinney House Church Street Goldsborough  Knaresborough North Yorkshire HG5 8NR UNITED KINGDOM , 44 1423860242 ,www.gold-w.co.uk
FML Wealth Limited,"undefinedUnit 3 Cheviot House, Mill Wynd   Haddington East Lothian EH41 4EX UNITED KINGDOM ", 44 3330030872 ,http://www.fmlwealth.com/
Wealth Solutions Ltd,undefined10 Beck Head Kirkby Lonsdale   Carnforth Lancashire LA6 2AY UNITED KINGDOM , +44 01524271017 ,
Wealth Solutions (UK) Limited,undefined15 Frederick Road Edgbaston   Birmingham  B15 1JD UNITED KINGDOM , 44 01214465815 ,www.wealth-solutions.co.uk
Rhoss Dancey,undefined5 Seabrook Close    Bognor Regis West Sussex PO21 3UT UNITED KINGDOM , 44 1243265917 ,
Perspective (West) Limited,undefined15 English Walls    Oswestry Shropshire SY11 2PA UNITED KINGDOM , 44 01691671903 ,www.pfgl.co.uk/west
Eos Wealth Management Limited,undefined10 Exchange Square Primrose Street   London  EC2A 2BY UNITED KINGDOM , 44 08005884064 ,https://www.closebrothersam.com/campaigns/eos/home
Partners Wealth Management LLP,undefined20 St Andrew Street    London  EC4A 3AG UNITED KINGDOM , 44 02074444039 ,www.partnerswealthmanagement.co.uk
Eales Wealth Management Ltd,undefinedGARTH WILLOWS DANZEY GREEN LANE TANWORTH IN ARDEN  Solihull West Midlands B94 5BG UNITED KINGDOM , +44 01564741899 ,
Hentons Wealth Limited,undefinedHentons Northgate 118 North Street  Leeds West Yorkshire LS2 7PN UNITED KINGDOM , 44 1132340000 ,http://www.hentons.com/services/advisory/wealthmanagement
Old Mutual Wealth Limited,undefinedOld Mutual House Portland Terrace   Southampton Hampshire SO14 7EJ UNITED KINGDOM , 44 02380334411 ,www.oldmutualwealth.co.uk
Bartlett Wealth Management Ltd,undefinedBroadway Hall Horsforth   Leeds West Yorkshire LS18 4RS UNITED KINGDOM , 44 01132585711 ,http://www.bartlettgroup.com/product/wealth-management/
Clarity Wealth Management LLP,undefinedWaterside The Plains   Totnes  TQ9 5DW UNITED KINGDOM , +44 08002335599 ,
Prosperity Wealth Ltd,undefined2nd Floor Quay House The Waterfront  Brierley Hill West Midlands DY5 1XD UNITED KINGDOM , +44 01384390039 ,www.prosperitywealth.com
Adrian Smith Wealth Management Limited,undefined15 Olympic Court Boardmans Way Whitehills Business Park  Blackpool Lancashire FY4 5GU UNITED KINGDOM , 44 1253535535 ,
Whitman Fry Wealth Management Limited,undefined80 Coombe Road    New Malden  KT3 4QS UNITED KINGDOM , 44 2088281480 ,www.whitmanfry.co.uk
Griffins Financial Solutions Limited,undefined24-32 London Road    Newbury Berkshire RG14 1JX UNITED KINGDOM , 44 01635551333 ,www.griffinsfinancial.co.uk
Future Life Wealth Management Limited,undefinedFuture House 54 Ravenshorn Way Renishaw  Sheffield South Yorkshire S21 3WY UNITED KINGDOM , +44 01246435996 ,www.wealthmanagement.uk.com
OPUS Independent Financial Planning Limited,undefined1 Coleshill Street    Sutton Coldfield West Midlands B72 1SD UNITED KINGDOM , 44 1213544034 ,www.opus-ifp.com
Core Financial Services Ltd,undefinedAFH House Buntsford Drive Stoke Heath  Bromsgrove  B60 4JE UNITED KINGDOM , 44 01527577775 ,www.afhwm.co.uk
Prestige Wealth Planning Limited,undefinedSuite 19 Brooklands House 58 Marlborough Road Lancing Business Park  Lancing West Sussex BN15 8AF UNITED KINGDOM , 44 01903217237 ,www.prestigewp.co.uk
Golden Oak Wealth Management Limited,undefined11 Bishops Walk Barnack   Stamford Lincolnshire PE9 3EE UNITED KINGDOM , 44 1780723118 ,www.goldenoakwealthmanagement.co.uk
IC Wealth Financial Planning Limited,undefinedMillennium Bridge House 2 Lambeth Hill   London  EC4V 4AR UNITED KINGDOM , 44 02075625818 ,
Rock Wealth LLP,undefined3 Imperial Square    Cheltenham Glos GL50 1QB UNITED KINGDOM , 44 01242505505 ,rock-wealth.co.uk
HFMC Wealth Management Ltd,undefined29 St. John's Lane    London  EC1M 4NA UNITED KINGDOM , 44 2074004700 ,www.hfmcwealth.com
Sedulo Wealth Management Limited,undefinedRegency Court 62-66 Deansgate   Manchester Lancashire M3 2EN UNITED KINGDOM , 44 01612369077 ,www.sedulo.co.uk
Chic-Kending Ltd,undefined183 Clifton Road    Shefford Bedfordshire SG17 5AH UNITED KINGDOM , 44 1462337170 ,
Reynolds Wealth Management Ltd,undefined69 Upper St. John Street    Lichfield Staffordshire WS14 9DT UNITED KINGDOM , 44 1543418604 ,www.reynoldswealth.co.uk
Cavendish Medical Ltd,undefined1st Floor Devon House 171-177 Great Portland Street  London  W1W 5PQ UNITED KINGDOM , 44 02076367006 ,
Flying Colours Finance Ltd,undefinedUnit 2 Queens Square Ascot Business Park Lyndhurst Road Ascot Berkshire SL5 9FE UNITED KINGDOM , 44 1344266030 ,www.flyingcolourswealth.com
EB ASSOCIATES GROUP LIMITED,undefinedSuite C2 Water House Texcel Business Park Thames Road  Dartford Kent DA1 4TQ UNITED KINGDOM , 44 1322800062 ,
Imperial Wealth Management Limited,undefinedUnit B Upper Boat Trading Estate   Pontypridd Mid Glamorgan CF37 5BP UNITED KINGDOM , 44 8456436294 ,
HPZ.3 Limited,undefined69 Lionel Avenue Wendover   Aylesbury Buckinghamshire HP22 6LS UNITED KINGDOM , - 01296486836 ,www.hpz3.co.uk
County Capital Wealth Management Limited,undefinedProsperity House 1 Barnfield Road   Spennymoor Co Durham DL16 6EB UNITED KINGDOM , 44 01388439840 ,www.thepensionreviewservice.com
Ludlow Wealth Management Group Ltd,undefined172 Lord Street    Southport Merseyside PR9 0QA UNITED KINGDOM , 44 01704500324 ,www.ludco.co.uk
Lynas Vokes Investments Ltd,undefinedWelbourne Lane East Holbeach   Spalding Lincolnshire PE12 8AB UNITED KINGDOM , 44 01406424950 ,www.lynasvokes.co.uk
Cerno Capital Partners LLP,undefined34 Sackville St    London  W1S 3ED UNITED KINGDOM , 44 02070364117 ,-
DEWM Limited,undefined13 Heathside Park    Camberley Surrey GU15 1PT UNITED KINGDOM , 44 01276506065 ,-
Lakeside Wealth Management Limited,undefinedGround Floor Acorn Phase 3 High Street  Barnsley South Yorkshire S72 7BD UNITED KINGDOM , 44 3302230404 ,
IFPC Limited,undefinedFaulkner House Victoria Street   St. Albans Hertfordshire AL1 3SN UNITED KINGDOM , 44 01727837128 ,www.ifpc.co.uk
Blackfinch Investments Limited,"undefinedBlackfinch Investments Ltd, Unit 1350-1360 Montpellier Court Gloucester Business Park Brockworth Gloucester Gloucestershire GL3 4AH UNITED KINGDOM ", 44 01684571255 ,www.blackfinch.com
Fitzroy Wealth Management Limited,undefined17 Fitzroy Place    Glasgow Lanarkshire G3 7RW UNITED KINGDOM , 44 1412263184 ,www.fitzroywm.co.uk
Moneysworth Ltd,undefinedSuite D & E Oakfield House Springwood Way Tytherington Macclesfiled Cheshire SK10 2XA UNITED KINGDOM , 44 01625462744 ,www.moneysworth.co.uk
Intrinsic Wealth Limited,undefinedWiltshire Court Farnsby Street   Swindon Wiltshire SN1 5AH UNITED KINGDOM , 44 01793647400 ,www.intrinsicfs.com
Vinco Wealth Management Ltd,"undefinedCounty House St Mary's Street, Worcester    WR1 1HB UNITED KINGDOM ", 44 2074128907 ,www.vincowealth.co.uk
Intuitive Associates Limited,undefinedCorner House Robey Close Linby  Nottingham Nottinghamshire NG15 8AA UNITED KINGDOM , +44 1158967881 ,
Sigma Wealth Partners Ltd,undefined9 Showell Lane    Wolverhampton West Midlands WV4 4TZ UNITED KINGDOM , 44 01902324537 ,http://swpartners.co.uk/
Bestinvest (Consultants) Limited,undefined6 Chesterfield Gardens    London  W1J 5BQ UNITED KINGDOM , 44 02071899999 ,www.tilney.co.uk
St. James's Place Wealth Management Plc,undefinedSt. James's Place House 1 Tetbury Road   Cirencester Gloucestershire GL7 1FP UNITED KINGDOM , 44 01285640302 ,www.sjp.co.uk
Richmond House Wealth Management,undefinedPremier House Argyle Way   Stevenage Hertfordshire SG1 2AD UNITED KINGDOM , 44 3332413350 ,www.richmondhousewm.co.uk
Evolution Wealth  Network Ltd,undefinedSussex House North Street   Horsham West Sussex RH12 1RQ UNITED KINGDOM , 44 1403334455 ,
Turpin Barker Armstrong,undefined1 Westmead Road    Sutton Surrey SM1 4LA UNITED KINGDOM , 44 02086617878 ,www.turpinbarkerarmstrong.co.uk
Tindle Wealth Management Limited,undefined124 Goswell Road    London  EC1V 7DP UNITED KINGDOM , 44 2038580637 ,www.tindlewealth.com
Henderson Employee Benefits Limited,undefinedMayesbrook House Lawnswood Business Park Redvers Close  Leeds West Yorkshire LS16 6QY UNITED KINGDOM , 44 01132223311 ,www.heb.uk.com
Host Capital Limited,undefined73 New Bond Street    London  W1S 1RS UNITED KINGDOM , 44 02072909490 ,www.hostcapital.com
Smart Financial Planning Ltd,undefinedThe Victoria 29 Stamford Street   Altrincham Cheshire wa14 1ex UNITED KINGDOM , 44 08448246990 ,-
Phoenix Wealth Services Limited,undefinedPhoenix Wealth Services Limited 1 Wythall Green Way Wythall  Birmingham West Midlands B47 6WG UNITED KINGDOM , 44 02035679100 ,www.phoenixwealth.co.uk
Investacc Wealth Management Limited,undefinedMinerva House Port Road Business Park   Carlisle Cumbria CA2 7AF UNITED KINGDOM , 44 01228538988 ,www.Investacc.co.uk
Old Mutual Wealth Life Assurance Limited,undefinedOld Mutual House Portland Terrace   Southampton Hampshire SO14 7AY UNITED KINGDOM , 44 2380334411 ,
Wealth for Women Limited,undefined2nd Floor Berkeley Square House Berkeley Square Mayfair  London W1J 6BD UNITED KINGDOM , 44 02071172628 ,www.wealthforwomen.biz
Prydis Wealth Limited,undefinedSenate Court Southernhay Gardens   Exeter Devon EX1 1NT UNITED KINGDOM , 44 01392432431 ,www.prydis.com
Nicholas Corfield,undefinedFormosa Wealth Management Ground Floor 42-44 Grosvenor Gardens  London  SW1 0EB UNITED KINGDOM , 44 07711417381 ,www.formosawealthmangement.co.uk
PSigma Investment Management Limited,undefined11 Strand    London  WC2N 5HR UNITED KINGDOM , 44 02033275000 ,www.psigma.com
Asset Investment Management Ltd,undefined11 Hazel Close Taverham   Norwich Norfolk NR8 6YE UNITED KINGDOM , 44 01603869988 ,www.asset-im.co.uk
G & E Wealth Management Ltd,undefinedTriune Court Monks Cross Drive   York North Yorkshire YO32 9GZ UNITED KINGDOM , 44 01904464100 ,https://www.garbutt-elliott.co.uk/wealth-management/
Synergy Wealth Management Ltd,undefined3 Eastland Close West Cross   Swansea West Glamorgan SA3 5NU UNITED KINGDOM , 44 01792401299 ,mobile 07766 966893
Platinum Wealth Management Limited,undefined1 Thimble Lane 1678 High Street Knowle  Solihull West Midlands B93 0LY UNITED KINGDOM , 44 01564772677 ,
John Morrison,"undefinedArena Business Centre 9 Nimrod Way, East Dorset Trade Park   Wimborne Dorset BH21 7UH UNITED KINGDOM ", +44 07967005570 ,
Coloma Wealth Management LLP,undefinedSecond Floor Mitre House 12-14 Mitre Street  London  EC3A 5BU UNITED KINGDOM , * 02036035910 ,www.coloma-wealth.com
Monahans Financial Services Limited,undefinedFortescue House Court Street   Trowbridge Wiltshire BA14 8FA UNITED KINGDOM , 44 01225785570 ,www.monahans-wm.co.uk
Generation Asset Management (UK) Limited,undefined180 Piccadilly Suite 105   London  W1K 1QR UNITED KINGDOM , +44 02033289457 ,-
MBH Wealth Management Ltd,undefined9 Meads Street Meads   Eastbourne East Sussex BN20 7QY UNITED KINGDOM , 44 1323506191 ,
BRI Wealth Management PLC,undefinedBRI House Elm Court Copse Drive  Coventry West Midlands CV5 9RL UNITED KINGDOM , 44 01676523550 ,
Lumin Wealth Management Limited,undefined5 Sandridge Park Porters Wood   St Albans Hertfordshire AL3 6PH UNITED KINGDOM , 44 01727893333 ,www.luminwealth.co.uk
Perspective (Midlands & Cheshire) Limited,undefinedWhitehall House Sandy Lane   Newcastle Staffordshire ST5 0LZ UNITED KINGDOM , 44 1782711091 ,http://www.pfgl.co.uk/midlandscheshire
Barnet Financial Limited,undefinedFairchild House Redbourne Avenue   London  N3 2BP UNITED KINGDOM , 44 02083713111 ,
Compass Wealth Management Consultants Limited,undefined5 Lancer House Hussar Court Westside View  Waterlooville Hampshire PO7 7SE UNITED KINGDOM , 44 08700104914 ,www.compasswmc.com
Nedbank Private Wealth Limited,undefinedOld Mutual Place 2 Lambeth Hill   London  EC4V 4GG UNITED KINGDOM , 44 02070023612 ,www.nedbankprivatewealth.com
Northwood Wealth Management Ltd,undefinedThe Chestnuts 18 East Street   Farnham Surrey GU9 7SD UNITED KINGDOM , 44 3331219090 ,
MLM Wealth Management Ltd,undefined16 Carron Street    Nairn Morayshire IV12 5SJ UNITED KINGDOM , 44 1667459519 ,
NLP Financial Management Limited,"undefined2nd Floor, Charles House 108-110 Finchley Road   London  NW3 5JJ UNITED KINGDOM ", 44 02074725555 ,www.nlpfm.co.uk
St. James's Place Wealth Management (PCIS) Limited,undefinedSt. James's Place House 1 Tetbury Road   Cirencester Gloucestershire GL7 1FP UNITED KINGDOM , 44 01285640302 ,www.sjp.co.uk
Prosperity Wealth Management Limited,undefinedWhite Cottage Matlock Road   Chesterfield Derbyshire S42 7LD UNITED KINGDOM , 44 01246550331 ,www.prosperitywml.co.uk
Wealth Design Limited,undefinedVirage Point Green Lane   Cannock Staffordshire WS11 0NH UNITED KINGDOM , 44 01543571238 ,www.wealthdesign.co.uk
Golden Square Wealth Management Limited,undefinedJohnstone House 52-54 Rose Street   Aberdeen Aberdeenshire AB10 1HA UNITED KINGDOM , 44 1224408535 ,-
FB Wealth Management Ltd,undefined26 South St. Marys Gate    Grimsby South Humberside DN31 1LW UNITED KINGDOM , +44 03331122211 ,www.fbwealth.co.uk
AVN Wealth Managers LLP,undefinedA V N House 7 Midland Way Barlborough  Chesterfield Derbyshire S43 4XA UNITED KINGDOM , +44 08452179943 ,www.avnwealthmanagers.co.uk
BanyanTree Wealth Ltd,undefined16 Berkeley Street    London  W1J 8DZ UNITED KINGDOM , 44 2039073888 ,
Wealth Concierge Limited,"undefined246 Group, Crossway 156 Great Charles Street Queensway   Birmingham West Midlands B3 3HN UNITED KINGDOM ", 44 01217280646 ,www.246wm.com
The Exeter Practice Limited,undefined1 Charlotte Mews Pavilion Place   Exeter Devon EX2 4HA UNITED KINGDOM , +44 01392432211 ,www.boulterbowen.co.uk
Wealth Wizards Advisers Limited,undefinedWizards House 8 Athena Court Tachbrook Park  Leamington Spa Warwickshire CV34 6RT UNITED KINGDOM , 44 01926671469 ,www.wealthwizards.com
PM+M Wealth Management Limited,undefinedGreenbank Technology Park Challenge Way   Blackburn Lancashire BB1 5QB UNITED KINGDOM , - 01254679138 ,
CN Wealth Limited,undefinedMarket House 10 Market Walk   Saffron Walden Essex CB10 1JZ UNITED KINGDOM , 44 1799521301 ,
Tideway Investment Partners LLP,undefinedThomas House 84 Eccleston Square   London  SW1V 1PX UNITED KINGDOM , +44 02031436100 ,www.tidewayinvestment.co.uk
Clarion Wealth Planning Limited,undefinedOverbank 52 London Road   Alderley Edge Cheshire SK9 7DZ UNITED KINGDOM , +44 01625466360 ,www.clarionwealth.co.uk
Goldstar Insurance Services Limited,undefinedLynton House 304 Bensham Lane    Thornton Heath Surrey cr7 7eq UNITED KINGDOM , 44 02086841851 ,www.goldstarwealthuk.co.uk
Sandycross Wealth Management LLP,undefinedMonkhurst House Sandy Cross Lane   Heathfield East Sussex TN21 8QR UNITED KINGDOM , +44 01435869010 ,www.sandycrosswealth.co.uk
Wake up your Wealth LLP,undefinedThe Powerhouse 21 21 Woodthorpe Road   Ashford Middlesex TW15 2RP UNITED KINGDOM , 44 02038937540 ,
Casterbridge Wealth Limited,undefinedSuite 4 Brewery House 36 Milford Street   Salisbury Wiltshire SP1 2AP UNITED KINGDOM , +44 1722466110 ,
Consilia Wealth Management LLP,undefinedClockhouse Court 5-7 London Road   St Albans Herts AL1 1LA UNITED KINGDOM , 44 01727832166 ,www.consiliawm.com
CDC Wealth Management Limited,"undefinedNorth East Business & Innovation Centre, Wearfield Park East Sunderland Enterprise Park  Sunderland Tyne and Wear SR5 2TA UNITED KINGDOM ", 44 01915166812 ,www.cdcwm.com
Briggs Murray Financial Planning & Wealth Management Ltd,undefinedSouthgate Business Centre 32 Gillygate   Pontefract West Yorkshire WF8 1PQ UNITED KINGDOM , 44 1977285720 ,www.BM-Wealth.co.uk
Wingate Wealth Management Ltd,undefinedQuadrant House 61-65 Croydon Road   Caterham Surrey CR3 6PB UNITED KINGDOM , +44 01883332261 ,www.wingatefp.com
A&M Wealth Management Ltd,undefinedBooths Hall Booths Park Chelford Road  Knutsford Cheshire WA16 8GS UNITED KINGDOM , 44 01565648226 ,www.amwealth.co.uk
Hawthorn Financial Services (Wealth Management) Limited,undefined31 Bashkir Road    Westbury Wiltshire BA13 3GY UNITED KINGDOM , 44 1373823917 ,www.hawthornfs.co.uk
XPAT Limited,undefinedBerkeley Square House 2nd Floor Berkeley Square  London London W1J 6BD UNITED KINGDOM , 44 3454504004 ,www.prismxpat.com
Balance: Wealth Planning Limited,undefinedThe Point Loughborough Road West Bridgford  Nottingham Nottinghamshire NG2 7QW UNITED KINGDOM , 44 1157722126 ,http://www.balancewealth.uk/
CONSOLIDARE WEALTH MANAGEMENT LTD,undefined7 Chalk Close    Folkestone Kent CT19 5TD UNITED KINGDOM , 44 7795565143 ,
Deutsche Alternative Asset Management (UK) Limited,undefinedThe Zig Zag Building 70 Victoria Street   London  SW1E 6SQ UNITED KINGDOM , +44 2075458000 ,
GEE 7 WEALTH MANAGEMENT LIMITED,undefined2 Park Plaza Battlefield Enterprise Park  Shrewsbury Shropshire SY1 3AF UNITED KINGDOM , 44 01743452430 ,www.gee7.co.uk
Wealth At Work Limited,undefined5 Temple Square    Liverpool Merseyside L2 5RH UNITED KINGDOM , 44 01512553400 ,www.wealthatwork.co.uk
Fusion Wealth Limited,undefinedSussex House North Street   Horsham West Sussex RH12 1RQ UNITED KINGDOM , 44 01403334455 ,www.fusionwealth.co.uk
Stewart Wealth Management Ltd,undefinedTuddenham Hall Estates Tuddenham   Ipswich  IP6 9DD UNITED KINGDOM , +44 01206845447 ,www.swm-ltd.co.uk
TSP Wealth LLP,undefined42 Wigmore Street   London  W1U 2RY UNITED KINGDOM , 44 2037589980 ,
Meridian Wealth Management Limited,"undefinedUnit 1, Office 5 Robin Mills Leeds Road Idle Bradford West Yorkshire BD10 9TE UNITED KINGDOM ", 44 1274620702 ,www.meridianwealth.co.uk
Walker Crips Wealth Management Limited,undefinedApollo House Eboracum Way   York  YO31 7RE UNITED KINGDOM , 44 1904544300 ,www.wcgplc.co.uk
Client First - Wealth Management Limited,undefinedClient First Wealth Management Ltd The Old Church 48 Verulam Road  St. Albans Hertfordshire AL3 4DH UNITED KINGDOM , 44 01727228628 ,www.cfwm.co.uk
Assured Private Wealth Limited,undefined25-29 Rumbridge Street Totton   Southampton  SO40 9DQ UNITED KINGDOM , 44 2380661166 ,
Novus Wealth Management Limited,undefinedWynyard Park House Wynyard Avenue Wynyard  Stockton on Tees  TS22 5TB UNITED KINGDOM , 44 1740667099 ,www.novuswealth.co.uk
Aurum Wealth LLP,undefinedRhydycadno Beidr Non Llannon  Llanelli Dyfed SA14 6BA UNITED KINGDOM , 44 7780661660 ,
Aviva Administration Limited,undefinedAviva Brierly Furlong Stoke Gifford  Bristol Avon BS34 8SW UNITED KINGDOM , 44 1179899000 ,www.aviva.com
Strategic Wealth Management Limited,undefined1 East Point Seal    Kent TN15 0EG UNITED KINGDOM , 44 01732760000 ,www.strategicwealth.co.uk
Anderson Wealth Management Ltd,undefined2 Marlborough Road    Swindon Wiltshire SN3 1QY UNITED KINGDOM , 44 01793741441 ,-
Athena Wealth Planning Limited,undefined2 The Square    Sevenoaks Kent TN13 2AA UNITED KINGDOM , 44 1732460521 ,www.athenawealthplanning.co.uk
Enigma Wealth Management Limited,undefinedKingswood House 80 Richardshaw Lane Stanningley  Pudsey West Yorkshire LS28 6BN UNITED KINGDOM , 44 1132396535 ,
The Wealth Management Partnership LLP,undefinedAshurst Lodge Church Lane Sunninghill  Ascot Berks SL5 7DD UNITED KINGDOM , 44 01344623318 ,-
Unique Wealth Limited,undefinedCentury Business Centre Century Business Park Manvers  Rotherham South Yorkshire S63 5DA UNITED KINGDOM , +44 01226295012 ,-
Future Planning Wealth Management Ltd,undefined42-43 Havelock Street First Floor   Swindon Wiltshire SN1 1SD UNITED KINGDOM , 44 01793575553 ,www.futureplanningwm.co.uk
Openwork Wealth Services Limited,undefined26th Floor 99 Bishopsgate   London  EC2M 3XD UNITED KINGDOM , 44 8456080164 ,
H&D Wealth Limited,undefinedThe Oast Maidstone Road Warmlake  Sutton Valence Kent ME17 3LQ UNITED KINGDOM , 44 01622845910 ,-
Parklands Wealth Limited,undefinedUnit B18 Kestrel Court Harbour Road   Portishead Bristol BS20 7AN ENGLAND , 44 077089549999 ,www.parklandswealth.com
Cullen Wealth Limited,undefinedUnit 2 The Embankment Business Park Riverview Vale Road Heaton Mersey Stockport Cheshire SK4 3GN UNITED KINGDOM , 44 01619756700 ,www.cullenwealth.co.uk
Fundamental Asset Management Ltd,undefinedCardinal Point Park Road   Rickmansworth Hertfordshire WD3 1RE UNITED KINGDOM , 44 01923713890 ,www.fundamentalasset.com
Bede Wealth Management Limited,undefinedJarrow Business Centre Viking Industrial Estate   Jarrow Tyne and Wear NE32 3DT UNITED KINGDOM , 44 01914283315 ,www.bedewealth.co.uk
Harpur Wealth Management Limited,undefined19 Goldington Road    Bedford  MK40 3JY UNITED KINGDOM , 44 1234924620 ,
