Company Name,Address,Phone,Website
Buck Wealth Management Limited,undefinedNorthgate Business Centre 38 North Gate   Newark Nottinghamshire NG24 1EZ UNITED KINGDOM , 44 1636642894 ,www.buckwealthmanagement.co.uk
Portus Wealth Limited,undefined21-25 High Street    Kinross  KY13 8AW UNITED KINGDOM , 44 1577351023 ,www.portuswealth.co.uk
R D Wealth Management Limited,undefined83a Cheltenham Road    Gloucester Gloucestershire GL2 0JG UNITED KINGDOM , 44 1452859040 ,www.rdwm.co.uk
Davidson Wealth Management Limited,undefinedThe Old Manse of Bourtie  Kirkton of Bourtie  Inverurie Aberdeenshire AB51 0JS UNITED KINGDOM , 44 7900680451 ,
West Bridgford Wealth Management Ltd,undefined76 Bridgford Road West Bridgford   Nottingham Nottinghamshire NG2 6AX UNITED KINGDOM , 44 7879404336 ,www.westbridgfordwm.co.uk
OneLife Wealth Advice Limited,undefinedThe Old Stables Bruntingthorpe   Lutterworth Leicestershire LE17 5QL UNITED KINGDOM , 44 1162478003 ,www.onelifewealthadvice.co.uk
Harmony Wealth Management Limited,undefinedPenmore House Hasland Road Hasland  Chesterfield Derbyshire S41 0SJ UNITED KINGDOM , 44 1246224030 ,www.harmonywm.co.uk
Anthony Mackintosh Wealth Management,undefinedCoombe Gate Pine Coombe   Croydon Surrey CR0 5HS UNITED KINGDOM , 44 2086621822 ,
4wealth Ltd,undefined361 Rayleigh Road    Leigh-on-Sea Essex SS9 5PS UNITED KINGDOM , 44 07379542788 ,
Aequus Wealth Management Ltd,"undefined7 Listed House, 46 Peckham Grove   London  SE15 6EW UNITED KINGDOM ", 44 2077085197 ,www.aequuswealth.co.uk
Irwell Wealth Management Ltd,undefinedBarton Hall Hardy Street   Manchester  M30 7NB UNITED KINGDOM , 44 1615377100 ,www.irwellwealthmanagement.co.uk
Financial Aspirations Lifestyle Planning Limited,undefinedThe Old Printworks Wellington Street   Thame Oxfordshire OX9 3BN UNITED KINGDOM , 44 1844215914 ,www.financialaspirations.com
Unity Wealth Management Limited,undefinedUnit 7 The Gardens   Fareham Hampshire PO16 8SS UNITED KINGDOM , 44 1329888494 ,www.unitywealthmanagement.co.uk
Aevitas Wealth Ltd,undefined5-7 Court Road    Bridgend Pen-y-bont ar Ogwr CF31 1BE UNITED KINGDOM , 44 01656658320 ,
Broad Wealth Management Ltd,undefined17 High St    Laurencekirk Kincardineshire AB30 1AA UNITED KINGDOM , - 01561377055 ,-
Peak Wealth Management Limited,undefined19 Greenways    Chesterfield Derbyshire S40 3HF UNITED KINGDOM , 44 7590244170 ,www.peakwm.co.uk
Jones Cooper Wealth Management Limited,"undefinedThe Stables Whinchat Hall, Skipwith Road Escrick  York North Yorkshire YO19 6EJ UNITED KINGDOM ", 44 1904728965 ,
David Hester Financial Services Limited,undefined93 Bucklow Gardens    Lymm Cheshire WA13 9RN UNITED KINGDOM , +44 01925758850 ,
Grange Wealth Management Ltd,undefined16 Coltbridge Avenue    Edinburgh Midlothian EH12 6AH UNITED KINGDOM , 44 1313468746 ,www.grangewealth.co.uk
3-S Financial Management,undefined15 Gold Hill    Shaftesbury Dorset SP7 8HB UNITED KINGDOM , 44 02380222410 ,www.3-sfinancial.com
Truscott Wealth Management Limited,undefined18 Birchwood Road    Alfreton Derbyshire DE55 7HB UNITED KINGDOM , 44 1773830333 ,
Bow House Wealth Management Limited,undefinedUnit 1 Ashfields Farm Industrial Estate Priors Court Road Hermitage Thatcham Berkshire RG18 9XY UNITED KINGDOM , 44 07900880995 ,-www.BHWM.co.uk
Andrew Parker Wealth Management Limited,undefined6 Willow Road    Solihull West Midlands B91 1UE UNITED KINGDOM , 44 1216082243 ,
Georgetown Wealth Management LLP,undefined3/4 135 Buchanan Street   Glasgow Lanarkshire G1 2JA UNITED KINGDOM , +44 01412212240 ,www.georgetownwealthmanagement.co.uk
Bramley Financial Planning limited,undefined62 Smithbrook Kilns    Cranleigh Surrey GU6 8JJ UNITED KINGDOM , 44 01483608602 ,bramleyfinancialplanning.com
Tatton Investment Management Limited,undefined8th Floor 125 Old Broad Street   London  EC2N 1AR UNITED KINGDOM , 44 2071902968 ,http://www.tattoninvestments.com/
PCWM Limited,undefinedPartnership House Monks Cross Drive Huntington  York  YO32 9GZ UNITED KINGDOM , 44 1430422655 ,
Vintage Health Limited,undefinedSovereign House 1 Albert Place   Finchley London N3 1QB UNITED KINGDOM , 44 02083715240 ,
Genesis Wealth Strategies Ltd,undefinedTanglewood Spen Lane Treales  Preston Lancashire PR4 3TE UNITED KINGDOM , 44 01772686464 ,
Infinity Wealth by Design Limited,undefined17 Hill Street    London  W1J 5LJ UNITED KINGDOM , 44 02036213322 ,www.infinitywealth.world
Welby Associates Wealth Management Ltd,undefinedThe House Of Vic Ryn Moira Road   Lisburn County Antrim BT28 2RF UNITED KINGDOM , 44 02892622910 ,
Rothschild & Co Wealth Management UK Limited,undefinedNew Court St. Swithin's Lane   London  EC4N 8AL UNITED KINGDOM , 44 2072805000 ,
Johnson Hunt Wealth Management Limited,undefined16 Dudley Street    Grimsby North East Lincolnshire DN31 2AB UNITED KINGDOM , 44 01472362884 ,-
Jonathan Davis Wealth Management Ltd,undefinedMill Cottage Vicarage Lane Waterford  Hertford Hertfordshire SG14 2PZ UNITED KINGDOM , 44 03458622919 ,www.jonathandaviswm.com
KB Wealth Management Ltd,undefined335 Ashby Road    Scunthorpe Lincolnshire DN16 2AB UNITED KINGDOM , 44 7482297279 ,www.kbwmltd.tppowered.com
Chequers Wealth Management Limited,undefined10a Chequers Yard St. Johns Street   Bridgnorth Shropshire WV15 6AG UNITED KINGDOM , 44 01746768479 ,www.chequerswealth.co.uk
EP Wealth Management Limited,undefinedCastlecroft Business Centre Tom Johnston Road   Dundee Angus DD4 8XD UNITED KINGDOM , 44 1382770070 ,www.epwealthmanagement.com
Milestone Wealth Ltd,undefinedProvincial House Suit 3 Third Floor New Walk  Leicester Leicestershire LE1 6TE UNITED KINGDOM , +44 01162081408 ,
Smart Wealth Planning Limited,undefinedVelocity Point Wreakes Lane   Dronfield Derbyshire S18 1PN UNITED KINGDOM , +44 7782303095 ,
Schroder Wealth Management (US) Limited,undefined1 London Wall Place    London  EC2Y 5AU UNITED KINGDOM , +44 2076586000 ,
Ineo (UK) Limited,undefined9 Church Street    Kidderminster Worcestershire DY10 2AD UNITED KINGDOM , 44 01562745730 ,www.cre8wm.co.uk
Capital Wealth Management (UK) Limited,undefined10 Lochside Place    Edinburgh Midlothian EH12 9RG UNITED KINGDOM , 44 7866733960 ,
Wealth West Limited,undefinedHarold Stephens 50 High Street Westbury-on-Trym  Bristol Avon BS9 3DZ UNITED KINGDOM , 44 01173636212 ,www.haroldstephens.co.uk
Collinson Wealth Management Limited,undefined6 Ringway Close    Macclesfield Cheshire SK10 2SU UNITED KINGDOM , 44 1625614117 ,
Advisory Wealth Management Ltd,undefined10 Sutton Close    Bury Lancashire BL8 2EL UNITED KINGDOM , 44 01617634887 ,
Berry Wealth Management Ltd,undefinedBowden House 36 Northampton Road   Market Harborough Leicestershire LE16 9HE UNITED KINGDOM , 44 1858467474 ,
IF Wealth Limited,"undefinedRiverside House, 6 Millbridge    Hertford Hertfordshire SG14 1PY UNITED KINGDOM ", 44 1992536373 ,
Objective Wealth Ltd,undefinedLittle Ghyll Durbans Road Wisborough Green  Billingshurst West Sussex RH14 0DQ UNITED KINGDOM , 44 7966546758 ,
Corfields (UK) Limited,"undefinedVenture House 2, Arlington Square Downshire Way  Bracknell  RG12 1WA UNITED KINGDOM ", 44 01344668130 ,www.corfieldswm.co.uk
Tony Fenton & Sons Wealth Management Limited,undefined29 Market Place Caistor   Market Rasen Lincolnshire LN7 6QE UNITED KINGDOM , 44 1472851114 ,
Managed Wealth Limited,undefinedSuite 33 10 Barley Mow Passage Chiswick  London  W4 4PH UNITED KINGDOM , 44 02087422191 ,
EJS Financial Planners Ltd,undefined18 Crendon Street    High Wycombe Buckinghamshire HP13 6LS UNITED KINGDOM , +44 1494530111 ,www.ejsfp.co.uk
Wrap Investments Wealth Management Limited,undefinedLumonics House Valley Drive Swift Valley Industrial Estate  Rugby Warwickshire CV21 1TQ UNITED KINGDOM , 44 01788833338 ,www.wrapinvestments.co.uk
Provident Wealth FS Ltd,undefined11 The Courtyard Shendish   Hemel Hempstead Hertfordshire HP3 0AS UNITED KINGDOM , +44 7540755987 ,www.providentwealth.co.uk
Nouveau Wealth Management Ltd,undefined7 Sovereigns Court    Kettering Northamptonshire NN16 9SS UNITED KINGDOM , 44 01536416729 ,
Montague Wealth Management Limited,undefinedBedford Business Centre 61-63 St Peters Road   Bedford Bedfordshire MK40 2PR UNITED KINGDOM , 44 01234364875 ,-
LTI Wealth Management Ltd,undefinedSuite 1.07 Eliot Park Innovation Centre 4 Barling Way  Nuneaton Warwickshire CV10 7RH UNITED KINGDOM , 44 2476796425 ,https://ltiwealth.trustedadviser.info
Mitchell Griffin Wealth Management Limited,undefined1 College Farm Building Tetbury Road   Cirencester Gloucestershire GL7 6PY UNITED KINGDOM , 44 08452730360 ,www.mitchellgriffin.co.uk
M R Wealth Management Consulting Limited,undefined1 Cranborne Gardens Oadby   Leicester Leicestershire LE2 4EZ UNITED KINGDOM , 44 01163677938 ,-
Riverstone Wealth Management Limited,undefinedRivergreen Centre  Aykley Heads  Durham County Durham DH1 5TS UNITED KINGDOM , 44 1913837395 ,www.rwml.co.uk
Brian McGoldrick Ltd,undefined32 Ardfern Road    Airdrie Lanarkshire ML6 8NN UNITED KINGDOM , 44 1236768937 ,
Imperial Wealth Advisory Limited,"undefined1st Floor Gateway House 4 Penman Way Grove Business Park, Enderby  Leicester Leicestershire LE19 1SY UNITED KINGDOM ", 44 7545238406 ,imperialwealthadvisory.co.uk
First Equitable (UK) Ltd,undefined2nd Floor 1 Old Hall Street   Liverpool Merseyside L3 9HF UNITED KINGDOM , +44 01512369973 ,www.first-equitable.co.uk
Henry F Dodds Wealth Management Limited,undefined3 St James Street    Newcastle Upon Tyne Tyne and Wear NE1 4NF UNITED KINGDOM , 44 01912610021 ,www.hfdodds.co.uk
Carnwyllon Wealth Management Ltd,undefinedMandel House Brodawel Llannon  Llanelli Dyfed SA14 6BJ UNITED KINGDOM , +44 01269841158 ,
Work Life Wealth Limited,undefined1 Lanyon Quay    Belfast County Antrim BT1 3LG UNITED KINGDOM , +44 02890267150 ,www.worklifewealth.com
Warby Wealth Management,undefinedWatling Cottage London Road Flamstead  St. Albans Herts AL3 8HQ UNITED KINGDOM , 44 01582841688 ,
IFS Family Wealth Advisers Ltd,undefinedThorncroft Manor Thorncroft Drive   Leatherhead Surrey KT22 8JB UNITED KINGDOM , 44 1372224020 ,
Tanager Wealth Management LLP,undefined3rd Floor 1 Bell Yard   London  WC2A 2JR UNITED KINGDOM , 44 02039656330 ,www.tanagerwealth.com
MLA Wealth Management Ltd,undefined45 Warren Road    Banstead Surrey SM7 1LG UNITED KINGDOM , 44 7795564710 ,www.mlawealthmanagement.co.uk
Quays Wealth Management Limited,undefinedUnit 2 Digital Park 3 Pacific Way  Salford Greater Manchester M50 1DR UNITED KINGDOM , 44 1619146084 ,www.quayswm.com
Tegamax Wealth Management Ltd,undefined9 Stables View Branton   Doncaster  DN3 3FR UNITED KINGDOM , 44 1302374773 ,www.tegamaxwm.co.uk
Perry Monroe Ltd,undefined2 Bell Street    Reigate Surrey RH2 7BG UNITED KINGDOM , 44 01737222646 ,http://www.perrymonroe.co.uk/
William Strong,undefined5 Kenyon Lane Heapey   Chorley Lancashire PR6 8EX UNITED KINGDOM , 44 01254830256 ,
Peartree Wealth Management Ltd,undefined23-25 Lower Street    Stansted Essex CM24 8LN UNITED KINGDOM , 44 01279851858 ,www.ptwm.co.uk
Kennedy Independent Financial Advice Limited,undefined27 Butcher Street    Strabane Tyrone BT82 8BJ UNITED KINGDOM , 44 02871886005 ,www.mkennedyfinancial.com
Jackson Hodge Wealth Management Services Limited,undefined20 Wall Drive Four Oaks   Sutton Coldfield West Midlands B74 4DF UNITED KINGDOM , +44 01213086257 ,
Horizon Wealth Management Limited,undefined22 Caesars Way    Broadstone Dorset BH18 9DP UNITED KINGDOM , 44 1202468285 ,www.horizonwealth.co.uk
Stafford & Co Ltd,undefinedThe Red House Bluecoats   Hertford Hertfordshire SG14 1AX UNITED KINGDOM , +44 01992501601 ,www.staffordwm.co.uk
Equinox Wealth Limited,"undefinedGreat Owl Barn Windmill Farm, Lamberhurst Quarter Lamberhurst  Tunbridge Wells Kent TN3 8AL UNITED KINGDOM ", 44 08456047404 ,
Adrian Gill,undefined7 Barthorpe Crescent    Leeds  LS17 5PE UNITED KINGDOM , +44 01132668617 ,
Chartered Wealth Management Limited,undefinedThe Lightwell 61-63 Brown Street   Manchester Greater Manchester M2 2JG UNITED KINGDOM , 44 1618264224 ,www.charteredwealthmanagement.co.uk
Robert Bruce Associates Limited,undefined73 St. Leonards Road    Northampton Northamptonshire NN4 8DN UNITED KINGDOM , 44 01604760766 ,
Expert Financial Solutions Ltd,undefinedWest Wing The Old Dairy High Cogges  Witney Oxfordshire OX29 6UN UNITED KINGDOM , 44 01993772467 ,www.expertwealth.co.uk
Surrey Independent Advisers Limited,undefinedDairy Courtyard 152-154 Ewell Road   SURBITON Surrey KT6 6HE UNITED KINGDOM , 44 02083353388 ,www.siainsurance.co.uk
J Monroe Ltd,undefinedHinksey Birchington Close   Bexhill-on-Sea East Sussex TN39 3TF UNITED KINGDOM , 44 1424252941 ,www.summitwealthmanagement.co.uk
Pilot Financial Planning Limited,undefined56 High Street    Totnes  TQ9 5SQ UNITED KINGDOM , 44 01803864092 ,www.pilotfinancial.co.uk
Heritage Wealth Solutions Ltd,undefinedSeven Hills Business Centre 2 South Street Morley  Leeds West Yorkshire LS27 8AT UNITED KINGDOM , 44 1133502080 ,www.heritagews.co.uk
London Wealth Management Limited,undefined6 Kingly Street    London  W1B 5PF UNITED KINGDOM , 44 02033262955 ,www.londonwm.co.uk
Edward Chappell Financial Services Ltd,undefined2 Surrey Glade 68 Surrey Road   Bournemouth Dorset BH4 9AH UNITED KINGDOM , +44 1202762483 ,www.echappellfinancial services.co.uk
Patrick O'Neill,undefined42-44 Grosvenor Gardens    London  SW1W 0EB UNITED KINGDOM , - 02035148224 ,-
ONE Capital Limited,undefinedSuite 201 Temple Chambers 3-7 Temple Avenue   London London EC4Y 0DT UNITED KINGDOM , +44 2075838304 ,-
Edison Wealth Management Limited,undefined6 Duke Street St. James's    London  SW1Y 6BN UNITED KINGDOM , 44 02072872225 ,www.edisonwm.com
Hay Hill Wealth Management Limited,undefined20 North Audley Street    London  W1K 6LX UNITED KINGDOM , 44 2039319680 ,www.hayhillwealth.com
Bond Wealth Management Ltd,undefined2nd Floor Eastcheap Court 11 Philpot Lane   London EC3M 8AA ENGLAND , 44 08702403007 ,www.bondfinancialservices.co.uk
Kingsfleet Wealth Limited,undefinedClaydon Court Old Ipswich Road  Claydon  Ipswich Suffolk IP6 0AE UNITED KINGDOM , +44 01473744724 ,-
Asset Wealth Management LLP,undefined10 Station Road    Letchworth Garden City Hertfordshire SG6 3AU UNITED KINGDOM , 44 08451700000 ,
Gilmour Hamilton Wealth Management LLP,undefined37 Portland Road    Kilmarnock Ayrshire KA1 2DJ UNITED KINGDOM , 44 1563537777 ,
Novitas Wealth Management Ltd,"undefinedUnit 2B, Suite 3B East Bridgford Business Park, Kneeton Road East Bridgford  Nottingham Nottinghamshire NG13 8PJ UNITED KINGDOM ", 44 1159771046 ,
Alpha Wealth Ltd,undefined1 St Colme St    Edinburgh Midlothian EH3 6AA UNITED KINGDOM , +44 01312021313 ,www.alphaifa.com
Macsen Wealth Management Ltd,undefinedThe Maltings East Tyndall Street   Cardiff South Glamorgan CF24 5EA UNITED KINGDOM , 44 2920004107 ,
I Planning Wealth Management Ltd,undefined6 College Street    Ammanford Camarthenshire SA18 3AF UNITED KINGDOM , 44 01269594263 ,www.i-planning.co.uk
Sustainable Wealth Ltd,undefined24 The Strand Derby     DE1 1BE ENGLAND , +44 1332300377 ,www.sustainablewealth.co.uk
Green Sky Wealth Limited,undefined72 St. Augustines Street    Norwich Norfolk NR3 3AD UNITED KINGDOM , 44 1603340800 ,www.greenskywealth.co.uk
Foxbrook Wealth Management Limited,undefinedFoxbrook House Old Warwick Road Rowington  Warwick Warwickshire CV35 7AB UNITED KINGDOM , 44 7973843822 ,
Sean McCarthy Wealth Management,undefined105 Moorgreen Road West End   Southampton Hampshire SO30 2HG UNITED KINGDOM , 44 7930616489 ,www.seanmccarthywm.co.uk
Dow Schofield Watts Wealth Advisory LLP,undefined7400 Daresbury Park Daresbury   Warrington Cheshire WA4 4BS UNITED KINGDOM , 44 1928715700 ,www.dswcf.co.uk
Aspirational Wealth Ltd,undefined46 Kingsknowe Road South    Edinburgh Midlothian EH14 2JW UNITED KINGDOM , 44 7917156706 ,
RiverPeak Wealth Limited,undefinedThe Dairy Office Burrell Road   Haywards Heath West Sussex RH16 1TW UNITED KINGDOM , +44 02037709892 ,www.riverpeakwealth.com
DLM Wealth Management LLP,undefinedOffice 4 219 Kensington High Street   London  W8 6BD UNITED KINGDOM , 44 7768856599 ,www.dlmwealth.com
Mallinson Wealth Management Limited,undefined47 Ashford Road Dronfield Woodhouse   Dronfield Derbyshire S18 8RT UNITED KINGDOM , 44 1246411472 ,
Sycamore Wealth LLP,undefined120 Bunns Lane   Mill Hill London  NW7 2AS UNITED KINGDOM , +44 02031142112 ,www.sycamorewealth.co.uk
Seasons of Wealth Ltd,undefinedSuite 404-405 Salisbury House  London Wall London  EC2M 5QQ UNITED KINGDOM , 44 2038138265 ,
Clarion Investment Management Limited,undefinedOverbank 52 London Road   Alderley Edge Cheshire SK9 7DZ UNITED KINGDOM , 44 01625466360 ,
Pluto Wealth Limited,undefined12 Park Hall Road    Reigate Surrey RH2 9LH UNITED KINGDOM , 44 1737457530 ,www.plutowealth.co.uk
Jennings Wealth Management Ltd,undefined1210 Arlington Business Park Theale   Reading Berkshire RG7 4TY UNITED KINGDOM , 44 1189654038 ,www.jenningswm.com
Wells Gibson Limited,undefinedProspect House Prospect Business Centre Gemini Crescent  Dundee Angus DD2 1TY SCOTLAND , 44 01382722989 ,www.wellsgibson.uk
Studio 61 Wealth Management,undefined1 Fairways    Lytham St. Annes Lancashire FY8 3NB UNITED KINGDOM , 44 7855816109 ,www.studio61weathmanagement.co.uk
ARC Wealth Management Ltd,undefined12 Heathfield Avenue    Fareham Hampshire PO15 5QA UNITED KINGDOM , 44 01329313998 ,-
Interactive Wealth Management Limited,undefined1st Floor 29 Park Circus   Glasgow Lanarkshire G3 6AP UNITED KINGDOM , 44 01413547955 ,www.interactivewealth.co.uk
Portal Wealth Management Ltd,undefined65 Preston Road    Lytham St. Annes Lancashire FY8 5BN UNITED KINGDOM , 44 1253738084 ,
Informed Wealth Management Ltd,undefined9 Barton Road Worsley   Manchester Lancashire M28 2PD UNITED KINGDOM , 44 7902873640 ,www.iwm.ltd
Wilcocks & Associates Ltd,undefinedWilcocks & Wilcocks 8 Water Street   Liverpool Merseyside L2 8TD UNITED KINGDOM , +44 1516014390 ,www.wilcocksandwilcocks.co.uk
Moneo Wealth Management Ltd,undefined45 Lower Redland Road    Bristol Avon BS6 6TB UNITED KINGDOM , 44 01179738288 ,www.moneo-ifa.co.uk
Aries Wealth Management Limited,undefinedWindsor House Cornwall Road   Harrogate North Yorkshire HG1 2PW UNITED KINGDOM , 44 1423209040 ,www.arieswealth.co.uk
Featherstone Partners Limited,undefinedOld Brewhouse The Yattendon Estate   Thatcham West Berkshire RG18 0UE UNITED KINGDOM , 44 2071838636 ,http://www.featherstonepartners.co.uk/
Harry Moore & Co,undefined24 Pound Road    Chatteris Cambridgeshire PE16 6RL UNITED KINGDOM , 44 1234215255 ,www.harrymoore.co.uk
Donald Asset Management Limited,undefinedStable End 12 Heather Court Gardens   Four Oaks West Midlands B74 2ST UNITED KINGDOM , 44 01213088034 ,www.donaldwm.co.uk
Accendo Markets Limited,undefinedWeWork 1 St. Katharines Way   London  E1W 1UN UNITED KINGDOM , 44 02030517463 ,www.accendomarkets.com
The Bobby Dhanjal Practice Ltd,undefined3 Merus Court Meridian Business Park   Leicester Leicestershire LE19 1RJ UNITED KINGDOM , 44 01162825137 ,www.bobbydhanjal.co.uk
QS Financial Planning Solutions Limited,undefinedUnit 4 Topaz Business Park Topaz Way  Bromsgrove  B61 0GD UNITED KINGDOM , 44 01217941771 ,www.qsfinancial.co.uk
Yorkshire Premier Financial Services Limited,undefined61 Westborough    Scarborough North Yorkshire YO11 1TS UNITED KINGDOM , 44 01723352005 ,www.ypfs.co.uk
Armstrong Watson Financial Planning Limited,undefined15 Victoria Place    Carlisle Cumbria CA1 1EW UNITED KINGDOM , 44 01132211300 ,www.armstrongwatson.co.uk
SW Wealth Limited,undefined1st Floor 100 West Regent Street   Glasgow  G2 2QD UNITED KINGDOM , 44 01413328088 ,www.shepweddfinancial.co.uk
Dukes Independent Financial Advisers Ltd,undefined145-147 Sparrows Herne    Bushey Hertfordshire WD23 1AQ UNITED KINGDOM , 44 2038242242 ,www.dukesifa.co.uk
Integrity Enterprises (Cheshire) Ltd,undefined34 Hesketh Croft Leighton   Crewe Cheshire CW1 4RY UNITED KINGDOM , 44 1270446304 ,www.integritywealthmanagement.co.uk
Seventy Two Wealth Ltd,undefined72 Derngate    Northampton Northamptonshire NN1 1UH UNITED KINGDOM , 44 01604633112 ,
Belyn Financial Services Ltd,undefined24 Clos Belyn Parc Marl   Llandudno Junction Gwynedd LL31 9AH UNITED KINGDOM , 44 01492582029 ,www.belyn.co.uk
Sancto Merricks Financial Planning Ltd,undefined20 Bourne Road    Bexley Kent DA5 1LU UNITED KINGDOM , 44 01322529490 ,www.sanctomerricks.co.uk
MedDen Financial Services LLP,undefinedMedDen House 3 Hanover Avenue   Leeds  LS3 1BG UNITED KINGDOM , 44 01132470088 ,www.meddenifa.com
West Financial Management Co Limited,undefined55 Hyde Park Road Mutley   Plymouth Devon PL3 4JN UNITED KINGDOM , 44 01752228382 ,www.westfm.biz
Mohammad Shahzad Ul Hassan,undefined131 Bournbrook Road    Birmingham West Midlands B29 7BY UNITED KINGDOM , +44 0121472029 ,
Stewardship Wealth Limited,undefinedStewardship Wealth Ltd Westpoint House Prospect Road  Westhill  AB32 6FJ UNITED KINGDOM , 44 1224972172 ,
Arena Wealth Management Limited,undefined3rd Floor Chiswick Gate 598-608 Chiswick High Road  London  W4 5RT UNITED KINGDOM , 44 02081041000 ,-
IIFL Wealth (UK) Limited,undefined19 Berkeley Street    London  W1J 8ED UNITED KINGDOM , +44 02079936929 ,www.iiflw.com
TFC Wealth Managers Ltd,undefined119 Bardykes Road Blantyre   Glasgow Lanarkshire G72 9UH UNITED KINGDOM , 44 1698712233 ,
Intelligent Wealth Planning Limited,undefinedThames Innovation Centre 2 Veridion Way   Erith Kent DA18 4AL UNITED KINGDOM , 44 02083201223 ,www.iwplanning.com
Woodhall Spa Wealth Management Limited,undefined7 Gorse Close    Woodhall Spa Lincolnshire LN10 6YA UNITED KINGDOM , 44 1526354864 ,http://www.woodhallwealth.co.uk/
Barwells Independent Financial Management Limited,undefined1 Station Farm Barns Station Road Glynde  Lewes East Sussex BN8 6EU UNITED KINGDOM , 44 01273086311 ,www.barwells-wealth.co.uk
Activus Wealth Limited,undefined16 Milbourne Lane    Esher Surrey KT10 9DX UNITED KINGDOM , 44 02036579728 ,
Clover Financial Planning Limited,undefinedPinbrook Court Venny Bridge   Exeter Devon EX4 8JQ UNITED KINGDOM , 44 1392272525 ,www.cloverwealth.co.uk
Polaris Wealth Management Limited,undefined45 Tylney Road    Sheffield South Yorkshire S2 2RX UNITED KINGDOM , 44 7760664876 ,
Cobalt Wealth Limited,"undefinedBooths Hall Booths Park, Chelford Road   Knutsford Cheshire WA16 8GS UNITED KINGDOM ", 44 1565648240 ,
Amber Wealth Creation Ltd,undefinedProsperity House Hanborough Business Park Long Hanborough  Witney Oxfordshire OX29 8SB UNITED KINGDOM , 44 01993886333 ,
Ferguson Wealth Management Limited,undefined46 Beaconsfield Road    Epsom Surrey KT18 6HE UNITED KINGDOM , 44 01372202543 ,
Claritas Wealth Management Limited,undefined182a Heaton Moor Road Heaton Moor   Stockport Cheshire SK4 4DU UNITED KINGDOM , 44 01616369200 ,www.claritaswm.co.uk
Define Financial Planning Limited,undefinedSuite 5 First Floor Pilgrims Court 15-17 West Street Reigate Surrey RH2 9BL UNITED KINGDOM , 44 01737888110 ,
My Financial Planner Limited,undefined10 Falcon Drive    Christchurch Dorset BH23 4BA UNITED KINGDOM , - 01425279212 ,www.mfpwealthmanagement.co.uk
Kim Bayliss Wealth Management Limited,undefined3 Ardens Close    Redditch Worcestershire B98 0QE UNITED KINGDOM , 44 1527529405 ,www.kbwm.co.uk
Hawker and Palmer Wealth Management Limited,undefinedWestward Court Westward Close Wrington  Bristol  BS40 5LU UNITED KINGDOM , 44 01934861222 ,
ForeSight Independent Financial Planning Ltd,undefinedRichmond House 1A Heath Road Hale  Altrincham Cheshire WA14 2XP UNITED KINGDOM , +44 1619269350 ,www.foresight-ifp.co.uk
Culver Financial Management Ltd,undefinedLlanmaes St. Fagans   Cardiff Caerdydd CF5 6DU UNITED KINGDOM , 44 02920675204 ,www.hanoverfm.co.uk
DOMINION FINANCIAL MANAGEMENT LIMITED,undefinedHeathfield Chapel Lane Willington  Tarporley Cheshire CW6 0PH UNITED KINGDOM , 44 1829423140 ,www.dominionfm.co.uk
Generic Financial Management Limited,undefined29 St. John's Lane    London  EC1M 4NA UNITED KINGDOM , 44 02074004700 ,www.hfmcwealth.com/gfm
London Premier Wealth Management Limited,undefined42-44 Grosvenor Gardens    London  SW1W 0EB UNITED KINGDOM , 44 2078084111 ,
Bluestone Wealth Advice Limited,undefined2 Fordwich Close    Hertford Hertfordshire SG14 2BJ UNITED KINGDOM , 44 7732446570 ,
DVelop Wealth Limited,undefinedUnit 2 Belmont Office Park 232-240 Belmont Road  Belfast County Antrim BT4 2AW UNITED KINGDOM , +44 2890382382 ,www.dvelopwealth.co.uk
Verity Wealth Management LLP,"undefinedSuite 11, The Hub New Century House Crowther Road  Washington Tyne and Wear NE38 0AQ UNITED KINGDOM ", +4419 15166353 ,
Otter Financial Services Limited,undefined62 Mill Street    Ottery St. Mary Devon EX11 1AF UNITED KINGDOM , 44 01404815551 ,www.otterfinancial.co.uk
Darroch Ltd,undefined42 Westbourne Crescent Bearsden   Glasgow East Dunbartonshire G61 4HD UNITED KINGDOM , 44 01412214463 ,www.connectfs.co.uk
Barnett Ravenscroft Financial Services Limited,undefined13 Portland Road Edgbaston   Birmingham West Midlands B16 9HN UNITED KINGDOM , 44 01214540901 ,www.brwm.co.uk
Carlson Wealth Management Ltd,undefinedBryn-y-Wawr Rudry   Caerphilly Caerffili CF83 3DF UNITED KINGDOM , +44 02921051528 ,www.carlsonwealthmanagement.co.uk
Wishart Wealth Management Ltd,undefined42 Charlotte Square    Edinburgh Midlothian EH2 4HQ UNITED KINGDOM , 44 1312262012 ,www.wishartwealth.co.uk
Ron McKay,undefinedGlebe House 12 St. Patricks Avenue Charvil  Reading Berkshire RG10 9RA UNITED KINGDOM , 44 01189345812 ,www.jarviswatson.co.uk
Questa Financial Services Ltd,"undefinedQuesta House Croft Court, Plumpton Close Whitehills Business Park  Blackpool Lancashire FY4 5PR UNITED KINGDOM ", 44 01253830050 ,http://www.questachartered.co.uk
Professional Independent Advisers Limited,undefinedHayward Court 2b Tettenhall Road   Wolverhampton West Midlands WV1 4SF UNITED KINGDOM , 44 01902379900 ,www.piawm.net
Knight James Associates Ltd,undefined6 Station Road    Thames Ditton Surrey KT7 0NR UNITED KINGDOM , 44 02083986677 ,
